-- phpMyAdmin SQL Dump
-- version 5.1.1deb3+focal1
-- https://www.phpmyadmin.net/
--
-- Host: localhost:3306
-- Generation Time: Dec 22, 2021 at 11:18 AM
-- Server version: 8.0.27-0ubuntu0.20.04.1
-- PHP Version: 7.4.26

SET SQL_MODE = "NO_AUTO_VALUE_ON_ZERO";
START TRANSACTION;
SET time_zone = "+00:00";


/*!40101 SET @OLD_CHARACTER_SET_CLIENT=@@CHARACTER_SET_CLIENT */;
/*!40101 SET @OLD_CHARACTER_SET_RESULTS=@@CHARACTER_SET_RESULTS */;
/*!40101 SET @OLD_COLLATION_CONNECTION=@@COLLATION_CONNECTION */;
/*!40101 SET NAMES utf8mb4 */;

--
-- Database: `bfc_group`
--

-- --------------------------------------------------------

--
-- Table structure for table `kdp_sale_report`
--

CREATE TABLE `kdp_sale_report` (
  `id` int NOT NULL,
  `OrderDate` varchar(255) CHARACTER SET utf8 COLLATE utf8_unicode_ci DEFAULT NULL,
  `BookTitle` varchar(255) CHARACTER SET utf8 COLLATE utf8_unicode_ci DEFAULT NULL,
  `AuthorName` varchar(255) CHARACTER SET utf8 COLLATE utf8_unicode_ci DEFAULT NULL,
  `Marketplace` varchar(255) CHARACTER SET utf8 COLLATE utf8_unicode_ci DEFAULT NULL,
  `UnitsSold` varchar(255) CHARACTER SET utf8 COLLATE utf8_unicode_ci DEFAULT NULL,
  `UnitsSoldrt` varchar(255) CHARACTER SET utf8 COLLATE utf8_unicode_ci DEFAULT NULL,
  `OrderItemStatus` varchar(255) CHARACTER SET utf8 COLLATE utf8_unicode_ci DEFAULT NULL,
  `created_at` timestamp NULL DEFAULT CURRENT_TIMESTAMP,
  `authorId` varchar(500) CHARACTER SET utf8 COLLATE utf8_unicode_ci DEFAULT NULL,
  `orderDay` int DEFAULT NULL,
  `orderMonth` int DEFAULT NULL,
  `orderYear` int DEFAULT NULL,
  `OrderDateDt` varchar(255) CHARACTER SET utf8 COLLATE utf8_unicode_ci DEFAULT NULL
) ENGINE=InnoDB DEFAULT CHARSET=utf8mb3 COLLATE=utf8_unicode_ci;

--
-- Dumping data for table `kdp_sale_report`
--

INSERT INTO `kdp_sale_report` (`id`, `OrderDate`, `BookTitle`, `AuthorName`, `Marketplace`, `UnitsSold`, `UnitsSoldrt`, `OrderItemStatus`, `created_at`, `authorId`, `orderDay`, `orderMonth`, `orderYear`, `OrderDateDt`) VALUES
(150, '12/31/2020', 'Unleashing Eternity Poems about stars, moon and you', 'Keerthi   Varagani ', 'KDP', '3', '3', '', '2021-01-15 05:10:31', 'KeerthiVaragani', 31, 12, 2020, '2020-12-31'),
(151, '12/16/2020', 'Safar-E-Kaafir', 'Shweta  Gour', 'KDP', '1', '1', '', '2021-01-15 05:10:31', 'ShwetaGour', 16, 12, 2020, '2020-12-16'),
(152, '12/6/2020', 'Dare To Dream', 'Mithun Paul', 'KDP', '1', '1', '', '2021-01-15 05:10:31', 'MithunPaul', 6, 12, 2020, '2020-12-06'),
(153, '12/6/2020', 'Safar-E-Kaafir', 'Shweta  Gour', 'KDP', '1', '1', '', '2021-01-15 05:10:31', 'ShwetaGour', 6, 12, 2020, '2020-12-06'),
(154, '12/5/2020', 'Succeed- The Way You Think', 'Roshan  Pandey ', 'KDP', '2', '2', '', '2021-01-15 05:10:31', 'RoshanPandey', 5, 12, 2020, '2020-12-05'),
(155, '12/4/2020', 'Jeevan Ke Kuch Adbhut Pal', 'Dinesh  Sahay', 'KDP', '1', '1', '', '2021-01-15 05:10:31', 'DineshSahay', 4, 12, 2020, '2020-12-04'),
(156, '12/3/2020', 'FINANCIAL DECISIONS FOR ENTREPRENEURIAL SUCCESS (Learn, Enrich Accentuate &amp; Perform)', 'CA Vinod  Kr. Sharma', 'KDP', '1', '1', '', '2021-01-15 05:10:31', 'CAVinodKr.Sharma', 3, 12, 2020, '2020-12-03'),
(157, '12/2/2020', 'Jeevan Ke Kuch Adbhut Pal', 'Dinesh  Sahay', 'KDP', '4', '4', '', '2021-01-15 05:10:31', 'DineshSahay', 2, 12, 2020, '2020-12-02'),
(158, '12/1/2020', 'Jeevan Ke Kuch Adbhut Pal', 'Dinesh  Sahay', 'KDP', '1', '1', '', '2021-01-15 05:10:31', 'DineshSahay', 1, 12, 2020, '2020-12-01'),
(159, '11/30/2020', 'FINANCIAL DECISIONS FOR ENTREPRENEURIAL SUCCESS (Learn, Enrich Accentuate &amp; Perform)', 'CA Vinod  Kr. Sharma', 'KDP', '1', '1', '', '2021-01-15 05:10:31', 'CAVinodKr.Sharma', 30, 11, 2020, '2020-11-30'),
(160, '11/29/2020', 'FINANCIAL DECISIONS FOR ENTREPRENEURIAL SUCCESS (Learn, Enrich Accentuate &amp; Perform)', 'CA Vinod  Kr. Sharma', 'KDP', '1', '1', '', '2021-01-15 05:10:31', 'CAVinodKr.Sharma', 29, 11, 2020, '2020-11-29'),
(161, '11/29/2020', 'Ragunath Vinay Shatak', 'Pt. Mukund  Lal Tiwari', 'KDP', '1', '1', '', '2021-01-15 05:10:31', 'Pt.MukundLalTiwari', 29, 11, 2020, '2020-11-29'),
(162, '11/28/2020', 'Speaking English Confidently And Effortlessly', 'Dr Arun  Behera', 'KDP', '1', '1', '', '2021-01-15 05:10:31', 'DrArunBehera', 28, 11, 2020, '2020-11-28'),
(163, '11/27/2020', 'Speaking English Confidently And Effortlessly', 'Dr Arun  Behera', 'KDP', '0', '0', '', '2021-01-15 05:10:31', 'DrArunBehera', 27, 11, 2020, '2020-11-27'),
(164, '11/26/2020', 'Speaking English Confidently And Effortlessly', 'Dr Arun  Behera', 'KDP', '1', '1', '', '2021-01-15 05:10:31', 'DrArunBehera', 26, 11, 2020, '2020-11-26'),
(165, '11/25/2020', 'Speaking English Confidently And Effortlessly', 'Dr Arun  Behera', 'KDP', '3', '3', '', '2021-01-15 05:10:31', 'DrArunBehera', 25, 11, 2020, '2020-11-25'),
(166, '11/24/2020', 'Ragunath Vinay Shatak', 'Pt. Mukund  Lal Tiwari', 'KDP', '1', '1', '', '2021-01-15 05:10:31', 'Pt.MukundLalTiwari', 24, 11, 2020, '2020-11-24'),
(167, '11/24/2020', 'Smart Classroom with Intelligent Projector ', 'Prof Amit Kumar  Mishra', 'KDP', '1', '1', '', '2021-01-15 05:10:31', 'ProfAmitKumarMishra', 24, 11, 2020, '2020-11-24'),
(168, '11/23/2020', 'Smart Classroom with Intelligent Projector ', 'Prof Amit Kumar  Mishra', 'KDP', '1', '1', '', '2021-01-15 05:10:31', 'ProfAmitKumarMishra', 23, 11, 2020, '2020-11-23'),
(169, '11/22/2020', 'Divasvapn', 'Jaiveer Singh Tyagi', 'KDP', '2', '2', '', '2021-01-15 05:10:31', 'JaiveerSinghTyagi', 22, 11, 2020, '2020-11-22'),
(170, '11/22/2020', 'Smart Classroom with Intelligent Projector ', 'Prof Amit Kumar  Mishra', 'KDP', '2', '2', '', '2021-01-15 05:10:31', 'ProfAmitKumarMishra', 22, 11, 2020, '2020-11-22'),
(171, '11/21/2020', 'Smart Classroom with Intelligent Projector ', 'Prof Amit Kumar  Mishra', 'KDP', '1', '1', '', '2021-01-15 05:10:31', 'ProfAmitKumarMishra', 21, 11, 2020, '2020-11-21'),
(172, '11/20/2020', 'Smart Classroom with Intelligent Projector ', 'Prof Amit Kumar  Mishra', 'KDP', '1', '1', '', '2021-01-15 05:10:31', 'ProfAmitKumarMishra', 20, 11, 2020, '2020-11-20'),
(173, '11/19/2020', 'Smart Classroom with Intelligent Projector ', 'Prof Amit Kumar  Mishra', 'KDP', '2', '2', '', '2021-01-15 05:10:31', 'ProfAmitKumarMishra', 19, 11, 2020, '2020-11-19'),
(174, '11/18/2020', 'Smart Classroom with Intelligent Projector ', 'Prof Amit Kumar  Mishra', 'KDP', '9', '9', '', '2021-01-15 05:10:31', 'ProfAmitKumarMishra', 18, 11, 2020, '2020-11-18'),
(175, '11/15/2020', 'Smart Classroom with Intelligent Projector ', 'Prof Amit Kumar  Mishra', 'KDP', '4', '4', '', '2021-01-15 05:10:31', 'ProfAmitKumarMishra', 15, 11, 2020, '2020-11-15'),
(176, '11/13/2020', 'Smart Classroom with Intelligent Projector ', 'Prof Amit Kumar  Mishra', 'KDP', '2', '2', '', '2021-01-15 05:10:31', 'ProfAmitKumarMishra', 13, 11, 2020, '2020-11-13'),
(177, '11/12/2020', 'Smart Classroom with Intelligent Projector ', 'Prof Amit Kumar  Mishra', 'KDP', '2', '2', '', '2021-01-15 05:10:31', 'ProfAmitKumarMishra', 12, 11, 2020, '2020-11-12'),
(178, '11/11/2020', 'Divasvapn', 'Jaiveer Singh Tyagi', 'KDP', '1', '1', '', '2021-01-15 05:10:31', 'JaiveerSinghTyagi', 11, 11, 2020, '2020-11-11'),
(179, '11/11/2020', 'Smart Classroom with Intelligent Projector ', 'Prof Amit Kumar  Mishra', 'KDP', '2', '2', '', '2021-01-15 05:10:31', 'ProfAmitKumarMishra', 11, 11, 2020, '2020-11-11'),
(180, '11/8/2020', 'Dare To Dream', 'Mithun Paul', 'KDP', '1', '1', '', '2021-01-15 05:10:31', 'MithunPaul', 8, 11, 2020, '2020-11-08'),
(181, '11/7/2020', 'Dare To Dream', 'Mithun Paul', 'KDP', '3', '3', '', '2021-01-15 05:10:31', 'MithunPaul', 7, 11, 2020, '2020-11-07'),
(182, '11/6/2020', 'Dare To Dream', 'Mithun Paul', 'KDP', '3', '3', '', '2021-01-15 05:10:31', 'MithunPaul', 6, 11, 2020, '2020-11-06'),
(183, '11/5/2020', 'Dare To Dream', 'Mithun Paul', 'KDP', '2', '2', '', '2021-01-15 05:10:31', 'MithunPaul', 5, 11, 2020, '2020-11-05'),
(184, '10/31/2020', 'Divasvapn', 'Jaiveer Singh Tyagi', 'KDP', '2', '2', '', '2021-01-15 05:10:31', 'JaiveerSinghTyagi', 31, 10, 2020, '2020-10-31'),
(185, '10/29/2020', 'STORY OF BED NO.24', 'Nitish Gautam', 'KDP', '1', '1', '', '2021-01-15 05:10:31', 'NitishGautam', 29, 10, 2020, '2020-10-29'),
(186, '10/19/2020', 'STORY OF BED NO.24', 'Nitish Gautam', 'KDP', '1', '1', '', '2021-01-15 05:10:31', 'NitishGautam', 19, 10, 2020, '2020-10-19'),
(187, '10/17/2020', 'STORY OF BED NO.24', 'Nitish Gautam', 'KDP', '1', '1', '', '2021-01-15 05:10:31', 'NitishGautam', 17, 10, 2020, '2020-10-17'),
(188, '10/20/2020', 'STORY OF BED NO.24', 'Nitish Gautam', 'KDP', '14', '14', '', '2021-01-15 05:10:31', 'NitishGautam', 20, 10, 2020, '2020-10-20'),
(189, '10/25/2020', 'Undying Love', 'Sadmin Sadique', 'KDP', '1', '1', '', '2021-01-15 05:10:31', 'Sadmin', 25, 10, 2020, '2020-10-25'),
(190, '10/30/2020', 'Divasvapn', 'Jaiveer Singh Tyagi', 'KDP', '2', '2', '', '2021-01-15 05:10:31', 'JaiveerSinghTyagi', 30, 10, 2020, '2020-10-30'),
(191, '9/26/2020', 'Kuchh Kuchh', 'Anoop Upadhyay', 'KDP', '1', '1', '', '2021-01-15 05:10:31', 'AnoopUpadhyay', 26, 9, 2020, '2020-09-26'),
(192, '8/29/2020', 'The Power To UNLOCK YOUR LIFE Post  Covid -19 Version ', 'RANDOLF BONIFACE PAUL', 'KDP', '1', '1', '', '2021-01-15 05:10:31', 'RANDOLFBONIFACEPAUL', 29, 8, 2020, '2020-08-29'),
(231, '10/13/2020', 'DECODER For UPSC Mains', 'Rahul Singh', 'Amazon', '1', '1', 'MFNShipment', '2021-01-15 05:10:58', 'RahulSingh', 13, 10, 2020, '2020-10-13'),
(232, '10/13/2020', 'DECODER For UPSC Mains', 'Rahul Singh', 'Amazon', '1', '1', 'MFNShipment', '2021-01-15 05:10:58', 'RahulSingh', 13, 10, 2020, '2020-10-13'),
(233, '10/13/2020', 'DECODER For UPSC Mains', 'Rahul Singh', 'Amazon', '1', '1', 'MFNShipment', '2021-01-15 05:10:58', 'RahulSingh', 13, 10, 2020, '2020-10-13'),
(234, '10/13/2020', 'DECODER For UPSC Mains', 'Rahul Singh', 'Amazon', '1', '1', 'MFNShipment', '2021-01-15 05:10:58', 'RahulSingh', 13, 10, 2020, '2020-10-13'),
(235, '10/13/2020', 'DECODER For UPSC Mains', 'Rahul Singh', 'Amazon', '1', '1', 'MFNShipment', '2021-01-15 05:10:58', 'RahulSingh', 13, 10, 2020, '2020-10-13'),
(236, '10/15/2020', 'DECODER For UPSC Mains', 'Rahul Singh', 'Amazon', '1', '1', 'MFNShipment', '2021-01-15 05:10:58', 'RahulSingh', 15, 10, 2020, '2020-10-15'),
(237, '10/15/2020', 'DECODER For UPSC Mains', 'Rahul Singh', 'Amazon', '1', '1', 'MFNShipment', '2021-01-15 05:10:58', 'RahulSingh', 15, 10, 2020, '2020-10-15'),
(238, '11/11/2020', 'DECODER For UPSC Mains', 'Rahul Singh', 'Amazon', '1', '1', 'MFNShipment', '2021-01-15 05:10:58', 'RahulSingh', 11, 11, 2020, '2020-11-11'),
(239, '11/11/2020', 'DECODER For UPSC Mains', 'Rahul Singh', 'Amazon', '1', '1', 'MFNShipment', '2021-01-15 05:10:58', 'RahulSingh', 11, 11, 2020, '2020-11-11'),
(240, '11/11/2020', 'DECODER For UPSC Mains', 'Rahul Singh', 'Amazon', '1', '1', 'MFNShipment', '2021-01-15 05:10:58', 'RahulSingh', 11, 11, 2020, '2020-11-11'),
(241, '10/13/2020', 'DECODER For UPSC Mains', 'Rahul Singh', 'Amazon', '-1', '1', 'Refund', '2021-01-15 05:10:58', 'RahulSingh', 13, 10, 2020, '2020-10-13'),
(242, '10/26/2020', 'DECODER For UPSC Mains', 'Rahul Singh', 'Amazon', '1', '1', 'MFNShipment', '2021-01-15 05:10:58', 'RahulSingh', 26, 10, 2020, '2020-10-26'),
(243, '12/03/2020', 'DECODER For UPSC Mains', 'Rahul Singh', 'Amazon', '1', '1', 'MFNShipment', '2021-01-15 05:10:58', 'RahulSingh', 3, 12, 2020, '2020-12-03'),
(244, '12/08/2020', 'DECODER For UPSC Mains', 'Rahul Singh', 'Amazon', '1', '1', 'MFNShipment', '2021-01-15 05:10:58', 'RahulSingh', 8, 12, 2020, '2020-12-08'),
(245, '12/09/2020', 'DECODER For UPSC Mains', 'Rahul Singh', 'Amazon', '1', '1', 'MFNShipment', '2021-01-15 05:10:58', 'RahulSingh', 9, 12, 2020, '2020-12-09'),
(246, '12/12/2020', 'DECODER For UPSC Mains', 'Rahul Singh', 'Amazon', '1', '1', 'MFNShipment', '2021-01-15 05:10:58', 'RahulSingh', 12, 12, 2020, '2020-12-12'),
(247, '12/09/2020', 'DECODER For UPSC Mains', 'Rahul Singh', 'Amazon', '-1', '1', 'Refund', '2021-01-15 05:10:58', 'RahulSingh', 9, 12, 2020, '2020-12-09'),
(248, '11/15/2020', 'DECODER For UPSC Mains', 'Rahul Singh', 'Amazon', '1', '1', 'MFNShipment', '2021-01-15 05:10:58', 'RahulSingh', 15, 11, 2020, '2020-11-15'),
(249, '11/16/2020', 'DECODER For UPSC Mains', 'Rahul Singh', 'Amazon', '1', '1', 'MFNShipment', '2021-01-15 05:10:58', 'RahulSingh', 16, 11, 2020, '2020-11-16'),
(250, '11/16/2020', 'DECODER For UPSC Mains', 'Rahul Singh', 'Amazon', '1', '1', 'MFNShipment', '2021-01-15 05:10:58', 'RahulSingh', 16, 11, 2020, '2020-11-16'),
(251, '11/15/2020', 'DECODER For UPSC Mains', 'Rahul Singh', 'Amazon', '1', '1', 'MFNShipment', '2021-01-15 05:10:58', 'RahulSingh', 15, 11, 2020, '2020-11-15'),
(252, '11/18/2020', 'DECODER For UPSC Mains', 'Rahul Singh', 'Amazon', '1', '1', 'MFNShipment', '2021-01-15 05:10:58', 'RahulSingh', 18, 11, 2020, '2020-11-18'),
(253, '11/18/2020', 'DECODER For UPSC Mains', 'Rahul Singh', 'Amazon', '1', '1', 'MFNShipment', '2021-01-15 05:10:58', 'RahulSingh', 18, 11, 2020, '2020-11-18'),
(254, '11/18/2020', 'DECODER For UPSC Mains', 'Rahul Singh', 'Amazon', '1', '1', 'MFNShipment', '2021-01-15 05:10:58', 'RahulSingh', 18, 11, 2020, '2020-11-18'),
(255, '11/19/2020', 'DECODER For UPSC Mains', 'Rahul Singh', 'Amazon', '1', '1', 'MFNShipment', '2021-01-15 05:10:58', 'RahulSingh', 19, 11, 2020, '2020-11-19'),
(256, '11/22/2020', 'DECODER For UPSC Mains', 'Rahul Singh', 'Amazon', '1', '1', 'MFNShipment', '2021-01-15 05:10:58', 'RahulSingh', 22, 11, 2020, '2020-11-22'),
(257, '11/23/2020', 'DECODER For UPSC Mains', 'Rahul Singh', 'Amazon', '1', '1', 'MFNShipment', '2021-01-15 05:10:58', 'RahulSingh', 23, 11, 2020, '2020-11-23'),
(258, '11/24/2020', 'DECODER For UPSC Mains', 'Rahul Singh', 'Amazon', '1', '1', 'MFNShipment', '2021-01-15 05:10:58', 'RahulSingh', 24, 11, 2020, '2020-11-24'),
(259, '11/24/2020', 'DECODER For UPSC Mains', 'Rahul Singh', 'Amazon', '1', '1', 'MFNShipment', '2021-01-15 05:10:58', 'RahulSingh', 24, 11, 2020, '2020-11-24'),
(260, '9/22/2020', 'DECODER For UPSC Mains', 'Rahul Singh', 'Flipkart', '-1', '1', 'CANCELLED', '2021-01-15 05:11:08', 'RahulSingh', 22, 9, 2020, '2020-09-22'),
(261, '9/22/2020', 'DECODER For UPSC Mains', 'Rahul Singh', 'Flipkart', '-1', '1', 'CANCELLED', '2021-01-15 05:11:08', 'RahulSingh', 22, 9, 2020, '2020-09-22'),
(262, '9/22/2020', 'DECODER For UPSC Mains', 'Rahul Singh', 'Flipkart', '-1', '1', 'CANCELLED', '2021-01-15 05:11:08', 'RahulSingh', 22, 9, 2020, '2020-09-22'),
(263, '9/22/2020', 'DECODER For UPSC Mains', 'Rahul Singh', 'Flipkart', '-1', '1', 'CANCELLED', '2021-01-15 05:11:08', 'RahulSingh', 22, 9, 2020, '2020-09-22'),
(264, '9/22/2020', 'DECODER For UPSC Mains', 'Rahul Singh', 'Flipkart', '-1', '1', 'CANCELLED', '2021-01-15 05:11:08', 'RahulSingh', 22, 9, 2020, '2020-09-22'),
(265, '10/30/2020', 'DECODER For UPSC Mains', 'Rahul Singh', 'Flipkart', '1', '1', 'DELIVERED', '2021-01-15 05:11:08', 'RahulSingh', 30, 10, 2020, '2020-10-30'),
(266, '10/30/2020', 'DECODER For UPSC Mains', 'Rahul Singh', 'Flipkart', '1', '1', 'DELIVERED', '2021-01-15 05:11:08', 'RahulSingh', 30, 10, 2020, '2020-10-30'),
(267, '10/29/2020', 'DECODER For UPSC Mains', 'Rahul Singh', 'Flipkart', '1', '1', 'DELIVERED', '2021-01-15 05:11:08', 'RahulSingh', 29, 10, 2020, '2020-10-29'),
(268, '10/29/2020', 'DECODER For UPSC Mains', 'Rahul Singh', 'Flipkart', '-1', '1', 'CANCELLED', '2021-01-15 05:11:08', 'RahulSingh', 29, 10, 2020, '2020-10-29'),
(269, '10/29/2020', 'DECODER For UPSC Mains', 'Rahul Singh', 'Flipkart', '-1', '1', 'CANCELLED', '2021-01-15 05:11:08', 'RahulSingh', 29, 10, 2020, '2020-10-29'),
(270, '10/29/2020', 'DECODER For UPSC Mains', 'Rahul Singh', 'Flipkart', '1', '1', 'DELIVERED', '2021-01-15 05:11:08', 'RahulSingh', 29, 10, 2020, '2020-10-29'),
(271, '10/23/2020', 'DECODER For UPSC Mains', 'Rahul Singh', 'Flipkart', '1', '1', 'DELIVERED', '2021-01-15 05:11:08', 'RahulSingh', 23, 10, 2020, '2020-10-23'),
(272, '10/23/2020', 'DECODER For UPSC Mains', 'Rahul Singh', 'Flipkart', '1', '1', 'DELIVERED', '2021-01-15 05:11:08', 'RahulSingh', 23, 10, 2020, '2020-10-23'),
(273, '10/23/2020', 'DECODER For UPSC Mains', 'Rahul Singh', 'Flipkart', '1', '1', 'DELIVERED', '2021-01-15 05:11:08', 'RahulSingh', 23, 10, 2020, '2020-10-23'),
(274, '10/23/2020', 'DECODER For UPSC Mains', 'Rahul Singh', 'Flipkart', '1', '1', 'DELIVERED', '2021-01-15 05:11:08', 'RahulSingh', 23, 10, 2020, '2020-10-23'),
(275, '10/23/2020', 'DECODER For UPSC Mains', 'Rahul Singh', 'Flipkart', '1', '1', 'DELIVERED', '2021-01-15 05:11:08', 'RahulSingh', 23, 10, 2020, '2020-10-23'),
(276, '10/23/2020', 'DECODER For UPSC Mains', 'Rahul Singh', 'Flipkart', '1', '1', 'DELIVERED', '2021-01-15 05:11:08', 'RahulSingh', 23, 10, 2020, '2020-10-23'),
(277, '11/1/2020', 'DECODER For UPSC Mains', 'Rahul Singh', 'Flipkart', '1', '1', 'DELIVERED', '2021-01-15 05:11:08', 'RahulSingh', 1, 11, 2020, '2020-11-01'),
(278, '11/1/2020', 'DECODER For UPSC Mains', 'Rahul Singh', 'Flipkart', '1', '1', 'DELIVERED', '2021-01-15 05:11:08', 'RahulSingh', 1, 11, 2020, '2020-11-01'),
(279, '11/24/2020', 'Kuchh Kuchh', 'Anoop Upadhyay', 'Flipkart', '-1', '1', 'RETURN_REQUESTED', '2021-01-15 05:11:08', 'AnoopUpadhyay', 24, 11, 2020, '2020-11-24'),
(280, '11/22/2020', 'DECODER For UPSC Mains', 'Rahul Singh', 'Flipkart', '1', '1', 'DELIVERED', '2021-01-15 05:11:08', 'RahulSingh', 22, 11, 2020, '2020-11-22'),
(281, '11/22/2020', 'Undying Love', 'Sadmin Sidique', 'Flipkart', '1', '1', 'DELIVERED', '2021-01-15 05:11:08', 'Sadmin', 22, 11, 2020, '2020-11-22'),
(282, '11/19/2020', 'DECODER For UPSC Mains', 'Rahul Singh', 'Flipkart', '1', '1', 'DELIVERED', '2021-01-15 05:11:08', 'RahulSingh', 19, 11, 2020, '2020-11-19'),
(283, '11/18/2020', 'DECODER For UPSC Mains', 'Rahul Singh', 'Flipkart', '1', '1', 'DELIVERED', '2021-01-15 05:11:08', 'RahulSingh', 18, 11, 2020, '2020-11-18'),
(284, '11/20/2020', 'DECODER For UPSC Mains', 'Rahul Singh', 'Flipkart', '-1', '1', 'CANCELLED', '2021-01-15 05:11:08', 'RahulSingh', 20, 11, 2020, '2020-11-20'),
(285, '12/28/2020', 'Ahilya', 'Adarsh Singh', 'Flipkart', '1', '1', 'DELIVERED', '2021-01-15 05:11:08', 'AdarshSingh', 28, 12, 2020, '2020-12-28'),
(286, '12/24/2020', 'DECODER For UPSC Mains', 'Rahul Singh', 'Flipkart', '1', '1', 'APPROVED', '2021-01-15 05:11:08', 'RahulSingh', 24, 12, 2020, '2020-12-24'),
(287, '12/9/2020', 'DECODER For UPSC Mains', 'Rahul Singh', 'Flipkart', '1', '1', 'DELIVERED', '2021-01-15 05:11:08', 'RahulSingh', 9, 12, 2020, '2020-12-09'),
(288, '12/9/2020', 'DECODER For UPSC Mains', 'Rahul Singh', 'Flipkart', '-1', '1', 'RETURNED', '2021-01-15 05:11:08', 'RahulSingh', 9, 12, 2020, '2020-12-09'),
(289, '12/9/2020', 'Undying Love', 'Sadmin Sidique', 'Flipkart', '1', '1', 'DELIVERED', '2021-01-15 05:11:08', 'Sadmin', 9, 12, 2020, '2020-12-09'),
(290, '12/9/2020', 'DECODER For UPSC Mains', 'Rahul Singh', 'Flipkart', '1', '1', 'DELIVERED', '2021-01-15 05:11:08', 'RahulSingh', 9, 12, 2020, '2020-12-09'),
(291, '12/13/2020', 'Mahakaal', 'Nitin Sharma', 'Flipkart', '1', '1', 'DELIVERED', '2021-01-15 05:11:08', 'NitinSharma', 13, 12, 2020, '2020-12-13'),
(292, '12/13/2020', 'Ahilya', 'Adarsh Singh', 'Flipkart', '1', '1', 'DELIVERED', '2021-01-15 05:11:08', 'AdarshSingh', 13, 12, 2020, '2020-12-13'),
(293, '12/13/2020', 'Ahilya', 'Adarsh Singh', 'Flipkart', '1', '1', 'DELIVERED', '2021-01-15 05:11:08', 'AdarshSingh', 13, 12, 2020, '2020-12-13'),
(294, '12/22/2020', 'DECODER For UPSC Mains', 'Rahul Singh', 'Flipkart', '-1', '1', 'CANCELLED', '2021-01-15 05:11:08', 'RahulSingh', 22, 12, 2020, '2020-12-22'),
(295, '12/22/2020', 'DECODER For UPSC Mains', 'Rahul Singh', 'Flipkart', '-1', '1', 'CANCELLED', '2021-01-15 05:11:08', 'RahulSingh', 22, 12, 2020, '2020-12-22'),
(296, '12/23/2020', 'DECODER For UPSC Mains', 'Rahul Singh', 'Flipkart', '1', '1', 'APPROVED', '2021-01-15 05:11:08', 'RahulSingh', 23, 12, 2020, '2020-12-23'),
(297, '12/26/2020', 'Ahilya', 'Adarsh Singh', 'Flipkart', '1', '1', 'DELIVERED', '2021-01-15 05:11:08', 'AdarshSingh', 26, 12, 2020, '2020-12-26'),
(298, '12/3/2020', 'Undying Love', 'Sadmin Sidique', 'Flipkart', '-1', '1', 'CANCELLED', '2021-01-15 05:11:08', 'Sadmin', 3, 12, 2020, '2020-12-03'),
(299, '12/25/2020', 'Ahilya', 'Adarsh Singh', 'Flipkart', '1', '1', 'DELIVERED', '2021-01-15 05:11:08', 'AdarshSingh', 25, 12, 2020, '2020-12-25'),
(300, '12/14/2020', 'Ahilya', 'Adarsh Singh', 'Flipkart', '1', '1', 'DELIVERED', '2021-01-15 05:11:08', 'AdarshSingh', 14, 12, 2020, '2020-12-14'),
(301, '12/11/2020', 'Ahilya', 'Adarsh Singh', 'Flipkart', '1', '1', 'DELIVERED', '2021-01-15 05:11:08', 'AdarshSingh', 11, 12, 2020, '2020-12-11'),
(302, '12/11/2020', 'The Power to UNLOCK YOUR LIFE Post Covid-19 version', 'Visu Paul', 'Flipkart', '1', '1', 'DELIVERED', '2021-01-15 05:11:08', 'VisuPaul', 11, 12, 2020, '2020-12-11'),
(303, '12/11/2020', 'Ahilya', 'Adarsh Singh', 'Flipkart', '1', '1', 'DELIVERED', '2021-01-15 05:11:08', 'AdarshSingh', 11, 12, 2020, '2020-12-11'),
(304, '12/18/2020', 'DECODER For UPSC Mains', 'Rahul Singh', 'Flipkart', '1', '1', 'DELIVERED', '2021-01-15 05:11:08', 'RahulSingh', 18, 12, 2020, '2020-12-18'),
(305, '12/16/2020', 'DECODER For UPSC Mains', 'Rahul Singh', 'Flipkart', '1', '1', 'DELIVERED', '2021-01-15 05:11:08', 'RahulSingh', 16, 12, 2020, '2020-12-16'),
(306, '10/21/2020', 'Ahilya', 'Adarsh Singh', 'GooglePlay', '1', '1', '', '2021-01-16 12:05:54', 'AdarshSingh', 21, 10, 2020, '2020-10-21'),
(307, '10/22/2020', 'Ahilya', 'Adarsh Singh', 'GooglePlay', '1', '1', '', '2021-01-16 12:05:54', 'AdarshSingh', 22, 10, 2020, '2020-10-22'),
(308, '10/23/2020', 'Ahilya', 'Adarsh Singh', 'GooglePlay', '1', '1', '', '2021-01-16 12:05:54', 'AdarshSingh', 23, 10, 2020, '2020-10-23'),
(309, '11/11/2020', 'Smart Classroom with Intelligent Projector', 'Prof Amit Kumar Mishra', 'GooglePlay', '1', '1', '', '2021-01-16 12:05:54', 'ProfAmitKumarMishra', 11, 11, 2020, '2020-11-11'),
(310, '11/17/2020', 'Dare To Dream', 'Mithun Paul', 'GooglePlay', '1', '1', '', '2021-01-16 12:05:54', 'MithunPaul', 17, 11, 2020, '2020-11-17'),
(311, '12/21/2020', 'Speaking English Confidently And Effortlessly', 'Dr Arun Behera', 'GooglePlay', '1', '1', '', '2021-01-16 12:05:54', 'DrArunBehera', 21, 12, 2020, '2020-12-21'),
(312, '12/14/2020', 'DECODER For UPSC Mains', 'Rahul Singh', 'Amazon', '1', '1', 'MFNShipment', '2021-03-01 09:07:17', 'RahulSingh', 14, 12, 2020, '2020-12-14'),
(313, '12/17/2020', 'DECODER For UPSC Mains', 'Rahul Singh', 'Amazon', '1', '1', 'MFNShipment', '2021-03-01 09:07:17', 'RahulSingh', 17, 12, 2020, '2020-12-17'),
(314, '12/20/2020', 'DECODER For UPSC Mains', 'Rahul Singh', 'Amazon', '1', '1', 'MFNShipment', '2021-03-01 09:07:17', 'RahulSingh', 20, 12, 2020, '2020-12-20'),
(315, '12/19/2020', 'DECODER For UPSC Mains', 'Rahul Singh', 'Amazon', '1', '1', 'MFNShipment', '2021-03-01 09:07:17', 'RahulSingh', 19, 12, 2020, '2020-12-19'),
(316, '12/14/2020', 'DECODER For UPSC Mains', 'Rahul Singh', 'Amazon', '-1', '1', 'Refund', '2021-03-01 09:07:17', 'RahulSingh', 14, 12, 2020, '2020-12-14'),
(317, '1/16/2021', 'Story of Bed No  24', 'Nitish Gautam', 'Amazon', '1', '1', 'MFNShipment', '2021-03-01 09:07:17', 'NitishGautam', 16, 1, 2021, '2021-01-16'),
(318, '1/17/2021', 'Story of Bed No  24', 'Nitish Gautam', 'Amazon', '1', '1', 'MFNShipment', '2021-03-01 09:07:17', 'NitishGautam', 17, 1, 2021, '2021-01-17'),
(319, '1/3/2021', 'DECODER For UPSC Mains', 'Rahul Singh', 'Amazon', '1', '1', 'MFNShipment', '2021-03-01 09:07:17', 'RahulSingh', 3, 1, 2021, '2021-01-03'),
(320, '1/20/2021', 'Jeevan Ke Kuch Adbhut Pal', 'Dinesh Sahay', 'Amazon', '1', '1', 'MFNShipment', '2021-03-01 09:07:17', 'DineshSahay', 20, 1, 2021, '2021-01-20'),
(321, '1/18/2021', 'I Value You', 'Polankey Eshwar Kumar ', 'Amazon', '1', '1', 'MFNShipment', '2021-03-01 09:07:17', 'PolankeyEshwarKumar', 18, 1, 2021, '2021-01-18'),
(322, '1/19/2021', 'I Value You', 'Polankey Eshwar Kumar ', 'Amazon', '1', '1', 'MFNShipment', '2021-03-01 09:07:17', 'PolankeyEshwarKumar', 19, 1, 2021, '2021-01-19'),
(323, '1/11/2021', 'DECODER For UPSC Mains', 'Rahul Singh', 'Amazon', '1', '1', 'MFNShipment', '2021-03-01 09:07:17', 'RahulSingh', 11, 1, 2021, '2021-01-11'),
(324, '1/13/2021', 'DECODER For UPSC Mains', 'Rahul Singh', 'Amazon', '1', '1', 'MFNShipment', '2021-03-01 09:07:17', 'RahulSingh', 13, 1, 2021, '2021-01-13'),
(325, '1/28/2021', 'I Value You', 'Polankey Eshwar Kumar ', 'Amazon', '1', '1', 'MFNShipment', '2021-03-01 09:07:17', 'PolankeyEshwarKumar', 28, 1, 2021, '2021-01-28'),
(326, '1/6/2021', 'Ahilya', 'Adarsh Singh', 'Flipkart', '1', '1', 'DELIVERED', '2021-03-01 09:07:36', 'AdarshSingh', 6, 1, 2021, '2021-01-06'),
(327, '1/6/2021', 'DECODER For UPSC Mains', 'Rahul Singh', 'Flipkart', '-1', '1', 'CANCELLED', '2021-03-01 09:07:36', 'RahulSingh', 6, 1, 2021, '2021-01-06'),
(328, '1/13/2021', 'Ragunath Vinay Shatak', 'Manoj Tiwari', 'Flipkart', '1', '1', 'DELIVERED', '2021-03-01 09:07:36', 'ManojTiwari', 13, 1, 2021, '2021-01-13'),
(329, '1/26/2021', 'Ishq E Namah', 'Pradeep Chaturvedi', 'Flipkart', '1', '1', 'DELIVERED', '2021-03-01 09:07:36', 'PradeepChaturvedi', 26, 1, 2021, '2021-01-26'),
(330, '1/26/2021', 'DECODER For UPSC Mains', 'Rahul Singh', 'Flipkart', '1', '1', 'DELIVERED', '2021-03-01 09:07:36', 'RahulSingh', 26, 1, 2021, '2021-01-26'),
(331, '1/3/2021', 'DECODER For UPSC Mains', 'Rahul Singh', 'Flipkart', '1', '1', 'DELIVERED', '2021-03-01 09:07:36', 'RahulSingh', 3, 1, 2021, '2021-01-03'),
(332, '1/27/2021', 'Ahilya', 'Adarsh Singh', 'Flipkart', '-1', '1', 'CANCELLED', '2021-03-01 09:07:36', 'AdarshSingh', 27, 1, 2021, '2021-01-27'),
(333, '1/27/2021', 'Gandhi Haar Gaye', 'Durgesh Pandey', 'Flipkart', '1', '1', 'DELIVERED', '2021-03-01 09:07:36', 'DurgeshPandey', 27, 1, 2021, '2021-01-27'),
(334, '1/1/2021', 'Story of Bed No. 24', 'Nitish Gautam', 'Flipkart', '1', '1', 'DELIVERED', '2021-03-01 09:07:36', 'NitishGautam', 1, 1, 2021, '2021-01-01'),
(335, '1/28/2021', 'Gandhi Haar Gaye', 'Durgesh Pandey', 'Flipkart', '1', '1', 'DELIVERED', '2021-03-01 09:07:36', 'DurgeshPandey', 28, 1, 2021, '2021-01-28'),
(336, '1/28/2021', 'Gandhi Haar Gaye', 'Durgesh Pandey', 'Flipkart', '1', '1', 'READY_TO_SHIP', '2021-03-01 09:07:36', 'DurgeshPandey', 28, 1, 2021, '2021-01-28'),
(337, '1/28/2021', 'Gandhi Haar Gaye', 'Durgesh Pandey', 'Flipkart', '1', '1', 'DELIVERED', '2021-03-01 09:07:36', 'DurgeshPandey', 28, 1, 2021, '2021-01-28'),
(338, '1/28/2021', 'Gandhi Haar Gaye', 'Durgesh Pandey', 'Flipkart', '1', '1', 'DELIVERED', '2021-03-01 09:07:36', 'DurgeshPandey', 28, 1, 2021, '2021-01-28'),
(339, '1/31/2021', 'Gandhi Haar Gaye', 'Durgesh Pandey', 'Flipkart', '1', '1', 'DELIVERED', '2021-03-01 09:07:36', 'DurgeshPandey', 31, 1, 2021, '2021-01-31'),
(340, '1/31/2021', 'DECODER For UPSC Mains', 'Rahul Singh', 'Flipkart', '-1', '1', 'CANCELLED', '2021-03-01 09:07:36', 'RahulSingh', 31, 1, 2021, '2021-01-31'),
(341, '1/29/2021', 'Gandhi Haar Gaye', 'Durgesh Pandey', 'Flipkart', '1', '1', 'DELIVERED', '2021-03-01 09:07:36', 'DurgeshPandey', 29, 1, 2021, '2021-01-29'),
(342, '1/29/2021', 'Gandhi Haar Gaye', 'Durgesh Pandey', 'Flipkart', '-1', '1', 'CANCELLED', '2021-03-01 09:07:36', 'DurgeshPandey', 29, 1, 2021, '2021-01-29'),
(343, '1/29/2021', 'Gandhi Haar Gaye', 'Durgesh Pandey', 'Flipkart', '-1', '1', 'CANCELLED', '2021-03-01 09:07:36', 'DurgeshPandey', 29, 1, 2021, '2021-01-29'),
(344, '1/29/2021', 'Gandhi Haar Gaye', 'Durgesh Pandey', 'Flipkart', '1', '1', 'DELIVERED', '2021-03-01 09:07:36', 'DurgeshPandey', 29, 1, 2021, '2021-01-29'),
(345, '1/27/2021', 'Jeevan Ke Kuch Adbhut Pal', 'Dinesh Sahay', 'GooglePlay', '1', '1', '', '2021-03-04 12:31:22', 'DineshSahay', 27, 1, 2021, '2021-01-27'),
(346, '1/24/2021', 'Madhubani Design Idea', 'Upasna Mishra', 'GooglePlay', '1', '1', '', '2021-03-04 12:31:22', 'UpasnaMishra', 24, 1, 2021, '2021-01-24'),
(347, '1/31/2021', 'Dare To Dream', 'Mithun Paul', 'KDP', '1', '1', '', '2021-03-04 12:34:28', 'MithunPaul', 31, 1, 2021, '2021-01-31'),
(348, '1/25/2021', 'Speaking English Confidently And Effortlessly', 'Dr Arun  Behera', 'KDP', '1', '1', '', '2021-03-04 12:34:28', 'DrArunBehera', 25, 1, 2021, '2021-01-25'),
(349, '1/24/2021', 'Bikhre Simtai Shabd', 'Neha  Beena', 'KDP', '1', '1', '', '2021-03-04 12:34:28', 'NehaBeena', 24, 1, 2021, '2021-01-24'),
(350, '1/23/2021', 'Bikhre Simtai Shabd', 'Neha  Beena', 'KDP', '3', '3', '', '2021-03-04 12:34:28', 'NehaBeena', 23, 1, 2021, '2021-01-23'),
(351, '1/23/2021', 'Ahilya', 'Adarsh Singh', 'KDP', '1', '1', '', '2021-03-04 12:34:28', 'AdarshSingh', 23, 1, 2021, '2021-01-23'),
(352, '1/21/2021', 'Bikhre Simtai Shabd', 'Neha  Beena', 'KDP', '1', '1', '', '2021-03-04 12:34:28', 'NehaBeena', 21, 1, 2021, '2021-01-21'),
(353, '1/20/2021', 'Shakti Chandrika', 'Dr. Balendu Tripathi', 'KDP', '1', '1', '', '2021-03-04 12:34:28', 'Dr.BalenduTripathi', 20, 1, 2021, '2021-01-20'),
(354, '1/20/2021', 'Bikhre Simtai Shabd', 'Neha  Beena', 'KDP', '1', '1', '', '2021-03-04 12:34:28', 'NehaBeena', 20, 1, 2021, '2021-01-20'),
(355, '1/19/2021', 'SHAPE YOUR THINKING  A Guide for Survival  Success in 21st Century', 'SHASHANK  MUTNEJA', 'KDP', '2', '2', '', '2021-03-04 12:34:28', 'SHASHANKMUTNEJA', 19, 1, 2021, '2021-01-19'),
(356, '1/18/2021', 'Sukhe Patte', 'Parminder Soni', 'KDP', '1', '1', '', '2021-03-04 12:34:28', 'ParminderSoni', 18, 1, 2021, '2021-01-18'),
(357, '1/18/2021', 'Kuchh Kuchh', 'Anoop Upadhyay', 'KDP', '1', '1', '', '2021-03-04 12:34:28', 'AnoopUpadhyay', 18, 1, 2021, '2021-01-18'),
(358, '1/18/2021', 'SHAPE YOUR THINKING  A Guide for Survival  Success in 21st Century', 'SHASHANK  MUTNEJA', 'KDP', '2', '2', '', '2021-03-04 12:34:28', 'SHASHANKMUTNEJA', 18, 1, 2021, '2021-01-18'),
(359, '1/17/2021', 'Sukhe Patte', 'Parminder Soni', 'KDP', '1', '1', '', '2021-03-04 12:34:28', 'ParminderSoni', 17, 1, 2021, '2021-01-17'),
(360, '1/17/2021', 'SHAPE YOUR THINKING  A Guide for Survival  Success in 21st Century', 'SHASHANK  MUTNEJA', 'KDP', '4', '4', '', '2021-03-04 12:34:28', 'SHASHANKMUTNEJA', 17, 1, 2021, '2021-01-17'),
(361, '1/16/2021', 'Ahilya', 'Adarsh Singh', 'KDP', '1', '1', '', '2021-03-04 12:34:28', 'AdarshSingh', 16, 1, 2021, '2021-01-16'),
(362, '1/13/2021', 'Ragunath Vinay Shatak', 'Pt. Mukund  Lal Tiwari', 'KDP', '1', '1', '', '2021-03-04 12:34:28', 'Pt.MukundLalTiwari', 13, 1, 2021, '2021-01-13'),
(363, '1/13/2021', 'It\'s the little things Turn your Life around', 'Radhika S.', 'KDP', '1', '1', '', '2021-03-04 12:34:28', 'RadhikaS.', 13, 1, 2021, '2021-01-13'),
(364, '1/10/2021', 'Unleashing Eternity Poems about stars, moon and you', 'Keerthi   Varagani', 'KDP', '1', '1', '', '2021-03-04 12:34:28', 'KeerthiVaragani', 10, 1, 2021, '2021-01-10'),
(365, '1/9/2021', 'FINANCIAL DECISIONS FOR ENTREPRENEURIAL SUCCESS (Learn, Enrich Accentuate &amp; Perform)', 'CA Vinod  Kr. Sharma', 'KDP', '1', '1', '', '2021-03-04 12:34:28', 'CAVinodKr.Sharma', 9, 1, 2021, '2021-01-09'),
(366, '1/9/2021', 'I Value You', 'Polankey Eshwar Kumar', 'KDP', '1', '1', '', '2021-03-04 12:34:28', 'PolankeyEshwarKumar', 9, 1, 2021, '2021-01-09'),
(367, '1/4/2021', 'SHAPE YOUR THINKING  A Guide for Survival  Success in 21st Century', 'SHASHANK  MUTNEJA', 'KDP', '2', '2', '', '2021-03-04 12:34:28', 'SHASHANKMUTNEJA', 4, 1, 2021, '2021-01-04'),
(368, '1/2/2021', 'SHAPE YOUR THINKING  A Guide for Survival  Success in 21st Century', 'SHASHANK  MUTNEJA', 'KDP', '5', '5', '', '2021-03-04 12:34:28', 'SHASHANKMUTNEJA', 2, 1, 2021, '2021-01-02'),
(369, '1/1/2021', 'Smart Classroom with Intelligent Projector', 'Prof Amit Kumar  Mishra', 'KDP', '1', '1', '', '2021-03-04 12:34:28', 'ProfAmitKumarMishra', 1, 1, 2021, '2021-01-01'),
(370, '1/1/2021', 'Unleashing Eternity Poems about stars, moon and you', 'Keerthi   Varagani', 'KDP', '1', '1', '', '2021-03-04 12:34:28', 'KeerthiVaragani', 1, 1, 2021, '2021-01-01'),
(500, '2/28/2021', 'Life Through My Eyes', 'Sumana .', 'KDP', '1', '1', '', '2021-03-17 06:10:17', 'SumanaAcherjeeMukherjee', 28, 2, 2021, '2021-02-28'),
(501, '2/28/2021', 'Life Through My Eyes', 'Sumana .', 'KDP', '1', '1', '', '2021-03-17 06:10:17', 'SumanaAcherjeeMukherjee', 28, 2, 2021, '2021-02-28'),
(502, '2/28/2021', 'SHAPE YOUR THINKING  A Guide for Survival  Success in 21st Century', 'SHASHANK  MUTNEJA', 'KDP', '1', '1', '', '2021-03-17 06:10:17', 'SHASHANKMUTNEJA', 28, 2, 2021, '2021-02-28'),
(503, '2/27/2021', 'Life Through My Eyes', 'Sumana .', 'KDP', '3', '3', '', '2021-03-17 06:10:17', 'SumanaAcherjeeMukherjee', 27, 2, 2021, '2021-02-27'),
(504, '2/27/2021', 'Life Through My Eyes', 'Sumana .', 'KDP', '1', '1', '', '2021-03-17 06:10:17', 'SumanaAcherjeeMukherjee', 27, 2, 2021, '2021-02-27'),
(505, '2/26/2021', 'Life Through My Eyes', 'Sumana .', 'KDP', '2', '2', '', '2021-03-17 06:10:17', 'SumanaAcherjeeMukherjee', 26, 2, 2021, '2021-02-26'),
(506, '2/26/2021', 'OBJECT + IF = I', 'Nilshree  Atish Yelulkar', 'KDP', '3', '3', '', '2021-03-17 06:10:17', 'NilshreeAtishYelulkar', 26, 2, 2021, '2021-02-26'),
(507, '2/26/2021', 'Life Through My Eyes', 'Sumana .', 'KDP', '1', '1', '', '2021-03-17 06:10:17', 'SumanaAcherjeeMukherjee', 26, 2, 2021, '2021-02-26'),
(508, '2/25/2021', 'Baagicha-E-Ghazal', 'Ronak  H Bhavsar', 'KDP', '1', '1', '', '2021-03-17 06:10:17', 'RonakHBhavsar', 25, 2, 2021, '2021-02-25'),
(509, '2/25/2021', 'OBJECT + IF = I', 'Nilshree  Atish Yelulkar', 'KDP', '3', '3', '', '2021-03-17 06:10:17', 'NilshreeAtishYelulkar', 25, 2, 2021, '2021-02-25'),
(510, '2/22/2021', 'Bikhre Simtai Shabd', 'Neha  Beena', 'KDP', '1', '1', '', '2021-03-17 06:10:17', 'NehaBeena', 22, 2, 2021, '2021-02-22'),
(511, '2/21/2021', 'Ahilya', 'Adarsh Singh', 'KDP', '1', '1', '', '2021-03-17 06:10:17', 'AdarshSingh', 21, 2, 2021, '2021-02-21'),
(512, '2/20/2021', 'Love Letters from the Earth', 'Yachna  Rajpoot', 'KDP', '1', '1', '', '2021-03-17 06:10:17', 'YachnaRajpoot', 20, 2, 2021, '2021-02-20'),
(513, '2/20/2021', 'Jeevan Ke Kuch Adbhut Pal', 'Dinesh  Sahay', 'KDP', '1', '1', '', '2021-03-17 06:10:17', 'DineshSahay', 20, 2, 2021, '2021-02-20'),
(514, '2/15/2021', 'A Dastae', 'Kafir .', 'KDP', '1', '1', '', '2021-03-17 06:10:17', 'Kafir.', 15, 2, 2021, '2021-02-15'),
(515, '2/14/2021', 'Sukhe Patte', 'Parminder Soni', 'KDP', '1', '1', '', '2021-03-17 06:10:17', 'ParminderSoni', 14, 2, 2021, '2021-02-14'),
(516, '2/8/2021', 'I Value You', 'Polankey Eshwar Kumar', 'KDP', '1', '1', '', '2021-03-17 06:10:17', 'PolankeyEshwarKumar', 8, 2, 2021, '2021-02-08'),
(517, '2/8/2021', 'Speaking English Confidently And Effortlessly', 'Dr Arun  Behera', 'KDP', '1', '1', '', '2021-03-17 06:10:17', 'DrArunBehera', 8, 2, 2021, '2021-02-08'),
(518, '2/6/2021', 'Speaking English Confidently And Effortlessly', 'Dr Arun  Behera', 'KDP', '1', '1', '', '2021-03-17 06:10:17', 'DrArunBehera', 6, 2, 2021, '2021-02-06'),
(519, '2/5/2021', 'Lab Manual of Pharmaceutical Organic Chemistry', 'Prem Kumar  Bichala', 'KDP', '1', '1', '', '2021-03-17 06:10:17', 'PremKumarBichala', 5, 2, 2021, '2021-02-05'),
(520, '2/4/2021', 'SHAPE YOUR THINKING  A Guide for Survival  Success in 21st Century', 'SHASHANK  MUTNEJA', 'KDP', '-1', '-1', '', '2021-03-17 06:10:17', 'SHASHANKMUTNEJA', 4, 2, 2021, '2021-02-04'),
(521, '2/4/2021', 'My New unexpected Life In Another World, Volume-1', 'Parvesh  Kumar', 'KDP', '1', '1', '', '2021-03-17 06:10:17', 'ParveshKumar', 4, 2, 2021, '2021-02-04'),
(522, '2/4/2021', 'Ahilya', 'Adarsh Singh', 'KDP', '1', '1', '', '2021-03-17 06:10:17', 'AdarshSingh', 4, 2, 2021, '2021-02-04'),
(523, '2/3/2021', 'Madhubani  Design Idea', 'Upasna  Mishra', 'KDP', '1', '1', '', '2021-03-17 06:10:17', 'UpasnaMishra', 3, 2, 2021, '2021-02-03'),
(524, '2/3/2021', 'Lab Manual of Pharmaceutical Organic Chemistry', 'Prem Kumar  Bichala', 'KDP', '1', '1', '', '2021-03-17 06:10:17', 'PremKumarBichala', 3, 2, 2021, '2021-02-03'),
(525, '2/3/2021', 'SHAPE YOUR THINKING  A Guide for Survival  Success in 21st Century', 'SHASHANK  MUTNEJA', 'KDP', '1', '1', '', '2021-03-17 06:10:17', 'SHASHANKMUTNEJA', 3, 2, 2021, '2021-02-03'),
(526, '2/3/2021', 'Ahilya', 'Adarsh Singh', 'KDP', '-1', '-1', '', '2021-03-17 06:10:17', 'AdarshSingh', 3, 2, 2021, '2021-02-03'),
(527, '2/28/2021', 'Secret To Lead Successful Life', 'Ananda Chandra Jena', 'GooglePlay', '1', '1', '', '2021-03-17 06:10:24', 'AnandaChandraJena', 28, 2, 2021, '2021-02-28'),
(528, '2/28/2021', 'Secret To Lead Successful Life', 'Ananda Chandra Jena', 'GooglePlay', '1', '1', '', '2021-03-17 06:10:24', 'AnandaChandraJena', 28, 2, 2021, '2021-02-28'),
(529, '2/3/2021', 'Sukhe Patte', 'Parminder Soni', 'Amazon', '2', '2', 'MFNShipment', '2021-03-17 06:10:30', 'ParminderSoni', 3, 2, 2021, '2021-02-03'),
(530, '2/3/2021', 'Sukhe Patte', 'Parminder Soni', 'Amazon', '1', '1', 'MFNShipment', '2021-03-17 06:10:30', 'ParminderSoni', 3, 2, 2021, '2021-02-03'),
(531, '2/3/2021', 'Madhubani Design Idea', 'Upasana  Mishra', 'Amazon', '1', '1', 'MFNShipment', '2021-03-17 06:10:30', 'UpasanaMishra', 3, 2, 2021, '2021-02-03'),
(532, '2/3/2021', 'Madhubani Design Idea', 'Upasana  Mishra', 'Amazon', '1', '1', 'MFNShipment', '2021-03-17 06:10:30', 'UpasanaMishra', 3, 2, 2021, '2021-02-03'),
(533, '2/8/2021', 'Madhubani Design Idea', 'Upasana  Mishra', 'Amazon', '1', '1', 'MFNShipment', '2021-03-17 06:10:30', 'UpasanaMishra', 8, 2, 2021, '2021-02-08'),
(534, '2/6/2021', 'Ishq E Namah', 'Pradeep Chaturvedi', 'Amazon', '1', '1', 'MFNShipment', '2021-03-17 06:10:30', 'PradeepChaturvedi', 6, 2, 2021, '2021-02-06'),
(535, '2/9/2021', 'I Value You', 'Polankey Eshwar Kumar', 'Amazon', '1', '1', 'MFNShipment', '2021-03-17 06:10:30', 'PolankeyEshwarKumar', 9, 2, 2021, '2021-02-09'),
(536, '2/15/2021', 'Jeevan Ke Kuch Adbhut Pal', 'Dinesh Sahay', 'Amazon', '1', '1', 'MFNShipment', '2021-03-17 06:10:30', 'DineshSahay', 15, 2, 2021, '2021-02-15'),
(537, '2/16/2021', 'Major Anand   Khwabon Ki Manjil Ka Nayak', 'Kalidas Pandey', 'Amazon', '1', '1', 'MFNShipment', '2021-03-17 06:10:30', 'KalidasPandey', 16, 2, 2021, '2021-02-16'),
(538, '2/1/2021', 'DECODER For UPSC Mains', 'Rahul Singh', 'Amazon', '1', '1', 'MFNShipment', '2021-03-17 06:10:30', 'RahulSingh', 1, 2, 2021, '2021-02-01'),
(539, '2/1/2021', 'DECODER For UPSC Mains', 'Rahul Singh', 'Amazon', '1', '1', 'MFNShipment', '2021-03-17 06:10:30', 'RahulSingh', 1, 2, 2021, '2021-02-01'),
(540, '2/2/2021', 'DECODER For UPSC Mains', 'Rahul Singh', 'Amazon', '1', '1', 'MFNShipment', '2021-03-17 06:10:30', 'RahulSingh', 2, 2, 2021, '2021-02-02'),
(541, '2/1/2021', 'DECODER For UPSC Mains', 'Rahul Singh', 'Amazon', '-1', '1', 'Refund', '2021-03-17 06:10:30', 'RahulSingh', 1, 2, 2021, '2021-02-01'),
(542, '2/1/2021', 'Gandhi Haar Gaye', 'Durgesh Pandey', 'Amazon', '1', '1', 'MFNShipment', '2021-03-17 06:10:30', 'DurgeshPandey', 1, 2, 2021, '2021-02-01'),
(543, '2/19/2021', 'Gandhi Haar Gaye', 'Durgesh Pandey', 'Amazon', '1', '1', 'MFNShipment', '2021-03-17 06:10:30', 'DurgeshPandey', 19, 2, 2021, '2021-02-19'),
(544, '2/1/2021', 'Gandhi Haar Gaye', 'Durgesh Pandey', 'Amazon', '1', '1', 'MFNShipment', '2021-03-17 06:10:30', 'DurgeshPandey', 1, 2, 2021, '2021-02-01'),
(545, '2/1/2021', 'Gandhi Haar Gaye', 'Durgesh Pandey', 'Amazon', '1', '1', 'MFNShipment', '2021-03-17 06:10:30', 'DurgeshPandey', 1, 2, 2021, '2021-02-01'),
(546, '2/7/2021', 'Sukhe Patte', 'Parminder Soni', 'Amazon', '1', '1', 'MFNShipment', '2021-03-17 06:10:30', 'ParminderSoni', 7, 2, 2021, '2021-02-07'),
(547, '2/19/2021', 'Gandhi Haar Gaye', 'Durgesh Pandey', 'Amazon', '1', '1', 'MFNShipment', '2021-03-17 06:10:30', 'DurgeshPandey', 19, 2, 2021, '2021-02-19'),
(548, '2/19/2021', 'Gandhi Haar Gaye', 'Durgesh Pandey', 'Amazon', '1', '1', 'MFNShipment', '2021-03-17 06:10:30', 'DurgeshPandey', 19, 2, 2021, '2021-02-19'),
(549, '2/19/2021', 'Ishq E Namah', 'Pradeep Chaturvedi', 'Amazon', '1', '1', 'MFNShipment', '2021-03-17 06:10:30', 'PradeepChaturvedi', 19, 2, 2021, '2021-02-19'),
(550, '2/2/2021', 'Gandhi Haar Gaye', 'Durgesh Pandey', 'Amazon', '1', '1', 'MFNShipment', '2021-03-17 06:10:30', 'DurgeshPandey', 2, 2, 2021, '2021-02-02'),
(551, '2/2/2021', 'Gandhi Haar Gaye', 'Durgesh Pandey', 'Amazon', '1', '1', 'MFNShipment', '2021-03-17 06:10:30', 'DurgeshPandey', 2, 2, 2021, '2021-02-02'),
(552, '2/21/2021', 'Gandhi Haar Gaye', 'Durgesh Pandey', 'Amazon', '1', '1', 'MFNShipment', '2021-03-17 06:10:30', 'DurgeshPandey', 21, 2, 2021, '2021-02-21'),
(553, '2/9/2021', 'Sukhe Patte', 'Parminder Soni', 'Amazon', '1', '1', 'MFNShipment', '2021-03-17 06:10:30', 'ParminderSoni', 9, 2, 2021, '2021-02-09'),
(554, '2/3/2021', 'Gandhi Haar Gaye', 'Durgesh Pandey', 'Amazon', '1', '1', 'MFNShipment', '2021-03-17 06:10:30', 'DurgeshPandey', 3, 2, 2021, '2021-02-03'),
(555, '2/1/2021', 'Gandhi Haar Gaye', 'Durgesh Pandey', 'Amazon', '-1', '1', 'Refund', '2021-03-17 06:10:30', 'DurgeshPandey', 1, 2, 2021, '2021-02-01'),
(556, '2/25/2021', '1987 Ek Kahani Aise Bhi', 'Prof Mahendra Shirsath', 'Amazon', '1', '1', 'MFNShipment', '2021-03-17 06:10:30', 'ProfMahendraShirsath', 25, 2, 2021, '2021-02-25'),
(557, '2/4/2021', 'Gandhi Haar Gaye', 'Durgesh Pandey', 'Amazon', '1', '1', 'MFNShipment', '2021-03-17 06:10:30', 'DurgeshPandey', 4, 2, 2021, '2021-02-04'),
(558, '2/4/2021', 'Gandhi Haar Gaye', 'Durgesh Pandey', 'Amazon', '1', '1', 'MFNShipment', '2021-03-17 06:10:30', 'DurgeshPandey', 4, 2, 2021, '2021-02-04'),
(559, '2/23/2021', 'Ishq E Namah', 'Pradeep Chaturvedi', 'Amazon', '1', '1', 'MFNShipment', '2021-03-17 06:10:30', 'PradeepChaturvedi', 23, 2, 2021, '2021-02-23'),
(560, '2/7/2021', 'Gandhi Haar Gaye', 'Durgesh Pandey', 'Amazon', '1', '1', 'MFNShipment', '2021-03-17 06:10:30', 'DurgeshPandey', 7, 2, 2021, '2021-02-07'),
(561, '2/6/2021', 'Gandhi Haar Gaye', 'Durgesh Pandey', 'Amazon', '1', '1', 'MFNShipment', '2021-03-17 06:10:30', 'DurgeshPandey', 6, 2, 2021, '2021-02-06'),
(562, '2/28/2021', '1987 Ek Kahani Aise Bhi', 'Prof Mahendra Shirsath', 'Amazon', '1', '1', 'MFNShipment', '2021-03-17 06:10:30', 'ProfMahendraShirsath', 28, 2, 2021, '2021-02-28'),
(563, '2/6/2021', 'Gandhi Haar Gaye', 'Durgesh Pandey', 'Amazon', '1', '1', 'MFNShipment', '2021-03-17 06:10:30', 'DurgeshPandey', 6, 2, 2021, '2021-02-06'),
(564, '2/28/2021', 'The Incredible', 'Mehar Bijapur', 'Amazon', '1', '1', 'MFNShipment', '2021-03-17 06:10:30', 'MeharBijapur', 28, 2, 2021, '2021-02-28'),
(565, '1/16/2021', 'DECODER For UPSC Mains', 'Rahul Singh', 'Amazon', '1', '1', 'MFNShipment', '2021-03-17 06:10:30', 'RahulSingh', 16, 1, 2021, '2021-01-16'),
(566, '1/16/2021', 'Ahilya', 'Adarsh Singh', 'Amazon', '1', '1', 'MFNShipment', '2021-03-17 06:10:30', 'AdarshSingh', 16, 1, 2021, '2021-01-16'),
(567, '1/11/2021', 'DECODER For UPSC Mains', 'Rahul Singh', 'Amazon', '-1', '1', 'Refund', '2021-03-17 06:10:30', 'RahulSingh', 11, 1, 2021, '2021-01-11'),
(568, '1/19/2021', 'DECODER For UPSC Mains', 'Rahul Singh', 'Amazon', '1', '1', 'MFNShipment', '2021-03-17 06:10:30', 'RahulSingh', 19, 1, 2021, '2021-01-19'),
(569, '1/21/2021', 'Ishq E Namah', 'Pradeep Chaturvedi', 'Amazon', '1', '1', 'MFNShipment', '2021-03-17 06:10:30', 'PradeepChaturvedi', 21, 1, 2021, '2021-01-21'),
(570, '1/21/2021', 'Ishq E Namah', 'Pradeep Chaturvedi', 'Amazon', '1', '1', 'MFNShipment', '2021-03-17 06:10:30', 'PradeepChaturvedi', 21, 1, 2021, '2021-01-21'),
(571, '1/21/2021', 'Ishq E Namah', 'Pradeep Chaturvedi', 'Amazon', '1', '1', 'MFNShipment', '2021-03-17 06:10:30', 'PradeepChaturvedi', 21, 1, 2021, '2021-01-21'),
(572, '1/21/2021', 'Ishq E Namah', 'Pradeep Chaturvedi', 'Amazon', '1', '1', 'MFNShipment', '2021-03-17 06:10:30', 'PradeepChaturvedi', 21, 1, 2021, '2021-01-21'),
(573, '1/21/2021', 'Ishq E Namah', 'Pradeep Chaturvedi', 'Amazon', '1', '1', 'MFNShipment', '2021-03-17 06:10:31', 'PradeepChaturvedi', 21, 1, 2021, '2021-01-21'),
(574, '1/23/2021', 'Ahilya', 'Adarsh Singh', 'Amazon', '1', '1', 'MFNShipment', '2021-03-17 06:10:31', 'AdarshSingh', 23, 1, 2021, '2021-01-23'),
(575, '1/25/2021', 'DECODER For UPSC Mains', 'Rahul Singh', 'Amazon', '1', '1', 'MFNShipment', '2021-03-17 06:10:31', 'RahulSingh', 25, 1, 2021, '2021-01-25'),
(576, '1/21/2021', 'Ishq E Namah', 'Pradeep Chaturvedi', 'Amazon', '1', '1', 'MFNShipment', '2021-03-17 06:10:31', 'PradeepChaturvedi', 21, 1, 2021, '2021-01-21'),
(577, '1/21/2021', 'Ishq E Namah', 'Pradeep Chaturvedi', 'Amazon', '1', '1', 'MFNShipment', '2021-03-17 06:10:31', 'PradeepChaturvedi', 21, 1, 2021, '2021-01-21'),
(578, '1/21/2021', 'Ishq E Namah', 'Pradeep Chaturvedi', 'Amazon', '1', '1', 'MFNShipment', '2021-03-17 06:10:31', 'PradeepChaturvedi', 21, 1, 2021, '2021-01-21'),
(579, '1/21/2021', 'Ishq E Namah', 'Pradeep Chaturvedi', 'Amazon', '1', '1', 'MFNShipment', '2021-03-17 06:10:31', 'PradeepChaturvedi', 21, 1, 2021, '2021-01-21'),
(580, '1/21/2021', 'Ishq E Namah', 'Pradeep Chaturvedi', 'Amazon', '1', '1', 'MFNShipment', '2021-03-17 06:10:31', 'PradeepChaturvedi', 21, 1, 2021, '2021-01-21'),
(581, '1/21/2021', 'Ishq E Namah', 'Pradeep Chaturvedi', 'Amazon', '2', '2', 'MFNShipment', '2021-03-17 06:10:31', 'PradeepChaturvedi', 21, 1, 2021, '2021-01-21'),
(582, '1/21/2021', 'Ishq E Namah', 'Pradeep Chaturvedi', 'Amazon', '1', '1', 'MFNShipment', '2021-03-17 06:10:31', 'PradeepChaturvedi', 21, 1, 2021, '2021-01-21'),
(583, '1/21/2021', 'Ishq E Namah', 'Pradeep Chaturvedi', 'Amazon', '1', '1', 'MFNShipment', '2021-03-17 06:10:31', 'PradeepChaturvedi', 21, 1, 2021, '2021-01-21'),
(584, '1/21/2021', 'Ishq E Namah', 'Pradeep Chaturvedi', 'Amazon', '1', '1', 'MFNShipment', '2021-03-17 06:10:31', 'PradeepChaturvedi', 21, 1, 2021, '2021-01-21'),
(585, '1/21/2021', 'Ishq E Namah', 'Pradeep Chaturvedi', 'Amazon', '1', '1', 'MFNShipment', '2021-03-17 06:10:31', 'PradeepChaturvedi', 21, 1, 2021, '2021-01-21'),
(586, '1/21/2021', 'Ishq E Namah', 'Pradeep Chaturvedi', 'Amazon', '1', '1', 'MFNShipment', '2021-03-17 06:10:31', 'PradeepChaturvedi', 21, 1, 2021, '2021-01-21'),
(587, '1/22/2021', 'Ishq E Namah', 'Pradeep Chaturvedi', 'Amazon', '1', '1', 'MFNShipment', '2021-03-17 06:10:31', 'PradeepChaturvedi', 22, 1, 2021, '2021-01-22'),
(588, '1/22/2021', 'Ishq E Namah', 'Pradeep Chaturvedi', 'Amazon', '1', '1', 'MFNShipment', '2021-03-17 06:10:31', 'PradeepChaturvedi', 22, 1, 2021, '2021-01-22'),
(589, '1/22/2021', 'Ishq E Namah', 'Pradeep Chaturvedi', 'Amazon', '1', '1', 'MFNShipment', '2021-03-17 06:10:31', 'PradeepChaturvedi', 22, 1, 2021, '2021-01-22'),
(590, '1/22/2021', 'Ishq E Namah', 'Pradeep Chaturvedi', 'Amazon', '1', '1', 'MFNShipment', '2021-03-17 06:10:31', 'PradeepChaturvedi', 22, 1, 2021, '2021-01-22'),
(591, '1/22/2021', 'Ishq E Namah', 'Pradeep Chaturvedi', 'Amazon', '1', '1', 'MFNShipment', '2021-03-17 06:10:31', 'PradeepChaturvedi', 22, 1, 2021, '2021-01-22'),
(592, '1/22/2021', 'Ishq E Namah', 'Pradeep Chaturvedi', 'Amazon', '1', '1', 'MFNShipment', '2021-03-17 06:10:31', 'PradeepChaturvedi', 22, 1, 2021, '2021-01-22'),
(593, '1/21/2021', 'Ishq E Namah', 'Pradeep Chaturvedi', 'Amazon', '-1', '1', 'Refund', '2021-03-17 06:10:31', 'PradeepChaturvedi', 21, 1, 2021, '2021-01-21'),
(594, '1/23/2021', 'Ishq E Namah', 'Pradeep Chaturvedi', 'Amazon', '1', '1', 'MFNShipment', '2021-03-17 06:10:31', 'PradeepChaturvedi', 23, 1, 2021, '2021-01-23'),
(595, '1/23/2021', 'Ishq E Namah', 'Pradeep Chaturvedi', 'Amazon', '1', '1', 'MFNShipment', '2021-03-17 06:10:31', 'PradeepChaturvedi', 23, 1, 2021, '2021-01-23'),
(596, '1/26/2021', 'Ishq E Namah', 'Pradeep Chaturvedi', 'Amazon', '1', '1', 'MFNShipment', '2021-03-17 06:10:31', 'PradeepChaturvedi', 26, 1, 2021, '2021-01-26'),
(597, '1/22/2021', 'Ishq E Namah', 'Pradeep Chaturvedi', 'Amazon', '-1', '1', 'Refund', '2021-03-17 06:10:31', 'PradeepChaturvedi', 22, 1, 2021, '2021-01-22'),
(598, '1/28/2021', 'Ishq E Namah', 'Pradeep Chaturvedi', 'Amazon', '1', '1', 'MFNShipment', '2021-03-17 06:10:31', 'PradeepChaturvedi', 28, 1, 2021, '2021-01-28'),
(599, '1/21/2021', 'Ishq E Namah', 'Pradeep Chaturvedi', 'Amazon', '-1', '2', 'Refund', '2021-03-17 06:10:31', 'PradeepChaturvedi', 21, 1, 2021, '2021-01-21'),
(600, '1/31/2021', 'Ishq E Namah', 'Pradeep Chaturvedi', 'Amazon', '1', '1', 'MFNShipment', '2021-03-17 06:10:31', 'PradeepChaturvedi', 31, 1, 2021, '2021-01-31'),
(601, '1/21/2021', 'Ishq E Namah', 'Pradeep Chaturvedi', 'Amazon', '-1', '1', 'Refund', '2021-03-17 06:10:31', 'PradeepChaturvedi', 21, 1, 2021, '2021-01-21'),
(602, '2/26/2021', '1987 Ek Kahani Aise Bhi', 'Prof Mahendra Shirsath', 'Flipkart', '1', '1', 'READY_TO_SHIP', '2021-03-17 06:10:37', 'ProfMahendraShirsath', 26, 2, 2021, '2021-02-26'),
(603, '2/13/2021', 'Gandhi Haar Gaye', 'Durgesh Pandey', 'Flipkart', '1', '1', 'DELIVERED', '2021-03-17 06:10:37', 'DurgeshPandey', 13, 2, 2021, '2021-02-13'),
(604, '2/19/2021', 'Gandhi Haar Gaye', 'Durgesh Pandey', 'Flipkart', '1', '1', 'DELIVERED', '2021-03-17 06:10:37', 'DurgeshPandey', 19, 2, 2021, '2021-02-19'),
(605, '2/19/2021', 'Gandhi Haar Gaye', 'Durgesh Pandey', 'Flipkart', '1', '1', 'DELIVERED', '2021-03-17 06:10:37', 'DurgeshPandey', 19, 2, 2021, '2021-02-19'),
(606, '2/19/2021', 'Gandhi Haar Gaye', 'Durgesh Pandey', 'Flipkart', '-1', '1', 'RETURNED', '2021-03-17 06:10:37', 'DurgeshPandey', 19, 2, 2021, '2021-02-19'),
(607, '2/4/2021', 'DECODER For UPSC Mains', 'Rahul Singh', 'Flipkart', '-1', '1', 'CANCELLED', '2021-03-17 06:10:37', 'RahulSingh', 4, 2, 2021, '2021-02-04'),
(608, '2/4/2021', 'Gandhi Haar Gaye', 'Durgesh Pandey', 'Flipkart', '1', '1', 'DELIVERED', '2021-03-17 06:10:37', 'DurgeshPandey', 4, 2, 2021, '2021-02-04'),
(609, '02/08/2021', 'Ahsaas   ', 'Sharad Singh Sharad', 'Flipkart', '1', '1', 'DELIVERED', '2021-03-17 06:10:37', 'SharadSinghSharad', 8, 2, 2021, '2021-02-08'),
(610, '2/8/2021', 'Gandhi Haar Gaye', 'Durgesh Pandey', 'Flipkart', '-1', '1', 'CANCELLED', '2021-03-17 06:10:37', 'DurgeshPandey', 8, 2, 2021, '2021-02-08'),
(611, '2/5/2021', 'Gandhi Haar Gaye', 'Durgesh Pandey', 'Flipkart', '1', '1', 'DELIVERED', '2021-03-17 06:10:37', 'DurgeshPandey', 5, 2, 2021, '2021-02-05'),
(612, '2/17/2021', 'Gandhi Haar Gaye', 'Durgesh Pandey', 'Flipkart', '1', '1', 'DELIVERED', '2021-03-17 06:10:37', 'DurgeshPandey', 17, 2, 2021, '2021-02-17'),
(613, '2/18/2021', 'DECODER For UPSC Mains', 'Rahul Singh', 'Flipkart', '-1', '1', 'RETURNED', '2021-03-17 06:10:37', 'RahulSingh', 18, 2, 2021, '2021-02-18'),
(614, '2/28/2021', 'Gandhi Haar Gaye', 'Durgesh Pandey', 'Flipkart', '1', '1', 'READY_TO_SHIP', '2021-03-17 06:10:37', 'DurgeshPandey', 28, 2, 2021, '2021-02-28'),
(615, '2/28/2021', 'Gandhi Haar Gaye', 'Durgesh Pandey', 'Flipkart', '1', '1', 'DELIVERED', '2021-03-17 06:10:37', 'DurgeshPandey', 28, 2, 2021, '2021-02-28'),
(616, '2/28/2021', 'Gandhi Haar Gaye', 'Durgesh Pandey', 'Flipkart', '1', '1', 'DELIVERED', '2021-03-17 06:10:37', 'DurgeshPandey', 28, 2, 2021, '2021-02-28'),
(617, '2/28/2021', 'Gandhi Haar Gaye', 'Durgesh Pandey', 'Flipkart', '1', '1', 'DELIVERED', '2021-03-17 06:10:37', 'DurgeshPandey', 28, 2, 2021, '2021-02-28'),
(618, '2/28/2021', 'Gandhi Haar Gaye', 'Durgesh Pandey', 'Flipkart', '-1', '1', 'CANCELLED', '2021-03-17 06:10:37', 'DurgeshPandey', 28, 2, 2021, '2021-02-28'),
(619, '2/28/2021', 'Gandhi Haar Gaye', 'Durgesh Pandey', 'Flipkart', '1', '1', 'DELIVERED', '2021-03-17 06:10:37', 'DurgeshPandey', 28, 2, 2021, '2021-02-28'),
(620, '2/28/2021', 'Gandhi Haar Gaye', 'Durgesh Pandey', 'Flipkart', '1', '1', 'READY_TO_SHIP', '2021-03-17 06:10:37', 'DurgeshPandey', 28, 2, 2021, '2021-02-28'),
(621, '2/28/2021', 'Gandhi Haar Gaye', 'Durgesh Pandey', 'Flipkart', '1', '1', 'READY_TO_SHIP', '2021-03-17 06:10:37', 'DurgeshPandey', 28, 2, 2021, '2021-02-28'),
(622, '2/3/2021', 'Gandhi Haar Gaye', 'Durgesh Pandey', 'Flipkart', '1', '1', 'DELIVERED', '2021-03-17 06:10:37', 'DurgeshPandey', 3, 2, 2021, '2021-02-03'),
(623, '2/12/2021', 'Ahilya', 'Adarsh Singh', 'Flipkart', '1', '1', 'DELIVERED', '2021-03-17 06:10:37', 'AdarshSingh', 12, 2, 2021, '2021-02-12'),
(624, '2/10/2021', 'Gandhi Haar Gaye', 'Durgesh Pandey', 'Flipkart', '1', '1', 'DELIVERED', '2021-03-17 06:10:37', 'DurgeshPandey', 10, 2, 2021, '2021-02-10'),
(625, '2/27/2021', 'Gandhi Haar Gaye', 'Durgesh Pandey', 'Flipkart', '1', '1', 'READY_TO_SHIP', '2021-03-17 06:10:37', 'DurgeshPandey', 27, 2, 2021, '2021-02-27'),
(626, '2/27/2021', 'Gandhi Haar Gaye', 'Durgesh Pandey', 'Flipkart', '1', '1', 'DELIVERED', '2021-03-17 06:10:37', 'DurgeshPandey', 27, 2, 2021, '2021-02-27');
INSERT INTO `kdp_sale_report` (`id`, `OrderDate`, `BookTitle`, `AuthorName`, `Marketplace`, `UnitsSold`, `UnitsSoldrt`, `OrderItemStatus`, `created_at`, `authorId`, `orderDay`, `orderMonth`, `orderYear`, `OrderDateDt`) VALUES
(627, '2/27/2021', 'Gandhi Haar Gaye', 'Durgesh Pandey', 'Flipkart', '1', '1', 'READY_TO_SHIP', '2021-03-17 06:10:37', 'DurgeshPandey', 27, 2, 2021, '2021-02-27'),
(628, '2/27/2021', 'Gandhi Haar Gaye', 'Durgesh Pandey', 'Flipkart', '1', '1', 'READY_TO_SHIP', '2021-03-17 06:10:38', 'DurgeshPandey', 27, 2, 2021, '2021-02-27'),
(629, '3/3/2021', 'Everlasting Magical Echoes', 'Dr. Kiran Prabhakar Rebello', 'GooglePlay', '1', '1', '', '2021-04-16 04:02:04', 'Dr.KiranPrabhakarRebello', 3, 3, 2021, '2021-03-03'),
(630, '3/3/2021', 'BRAHMASTRA-The Weapon Saviour For ICSE Computer Applications', 'SantoshKumar', 'GooglePlay', '1', '1', '', '2021-04-16 04:02:04', 'SantoshKumar', 3, 3, 2021, '2021-03-03'),
(631, '3/3/2021', 'BRAHMASTRA-The Weapon Saviour For ICSE Computer Applications', 'Santosh Kumar &amp; Shalini Shikha', 'GooglePlay', '1', '1', '', '2021-04-16 04:02:04', 'SantoshKumar', 3, 3, 2021, '2021-03-03'),
(632, '3/8/2021', 'BRAHMASTRA-The Weapon Saviour For ICSE Computer Applications', 'Santosh Kumar &amp; Shalini Shikha', 'GooglePlay', '1', '1', '', '2021-04-16 04:02:05', 'SantoshKumar', 8, 3, 2021, '2021-03-08'),
(633, '3/9/2021', 'BRAHMASTRA-The Weapon Saviour For ICSE Computer Applications', 'Santosh Kumar &amp; Shalini Shikha', 'GooglePlay', '1', '1', '', '2021-04-16 04:02:05', 'SantoshKumar', 9, 3, 2021, '2021-03-09'),
(634, '3/11/2021', 'BRAHMASTRA-The Weapon Saviour For ICSE Computer Applications', 'Santosh Kumar &amp; Shalini Shikha', 'GooglePlay', '1', '1', '', '2021-04-16 04:02:05', 'SantoshKumar', 11, 3, 2021, '2021-03-11'),
(635, '3/11/2021', 'BRAHMASTRA-The Weapon Saviour For ICSE Computer Applications', 'Santosh Kumar &amp; Shalini Shikha', 'GooglePlay', '1', '1', '', '2021-04-16 04:02:05', 'SantoshKumar', 11, 3, 2021, '2021-03-11'),
(636, '3/12/2021', 'BRAHMASTRA-The Weapon Saviour For ICSE Computer Applications', 'Santosh Kumar &amp; Shalini Shikha', 'GooglePlay', '1', '1', '', '2021-04-16 04:02:05', 'SantoshKumar', 12, 3, 2021, '2021-03-12'),
(637, '3/12/2021', 'BRAHMASTRA-The Weapon Saviour For ICSE Computer Applications', 'Santosh Kumar &amp; Shalini Shikha', 'GooglePlay', '1', '1', '', '2021-04-16 04:02:05', 'SantoshKumar', 12, 3, 2021, '2021-03-12'),
(638, '3/12/2021', 'Hurrah Yahoo (I AM 100%)', 'Aruna Johri', 'GooglePlay', '1', '1', '', '2021-04-16 04:02:05', 'ArunaJohri', 12, 3, 2021, '2021-03-12'),
(639, '3/12/2021', 'Hurrah Yahoo (I AM 100%)', 'Aruna Johri', 'GooglePlay', '1', '1', '', '2021-04-16 04:02:05', 'ArunaJohri', 12, 3, 2021, '2021-03-12'),
(640, '3/12/2021', 'BRAHMASTRA-The Weapon Saviour For ICSE Computer Applications', 'Santosh Kumar &amp; Shalini Shikha', 'GooglePlay', '1', '1', '', '2021-04-16 04:02:05', 'SantoshKumar', 12, 3, 2021, '2021-03-12'),
(641, '3/19/2021', 'Tunnel Construction: A Practical Approach Demystified', 'Dr. Ashok Kumar Sharma', 'GooglePlay', '1', '1', '', '2021-04-16 04:02:05', 'Dr.AshokKumarSharma', 19, 3, 2021, '2021-03-19'),
(642, '3/23/2021', 'A Dastae', 'Kafir,Ashish Joshi', 'GooglePlay', '1', '1', '', '2021-04-16 04:02:05', 'Kafir,AshishJoshi', 23, 3, 2021, '2021-03-23'),
(643, '3/28/2021', 'BRAHMASTRA-The Weapon Saviour For ICSE Computer Applications', 'Santosh Kumar &amp; Shalini Shikha', 'GooglePlay', '1', '1', '', '2021-04-16 04:02:05', 'SantoshKumar', 28, 3, 2021, '2021-03-28'),
(644, '2/10/2021', 'Gandhi Haar Gaye', 'Durgesh Pandey', 'Amazon', '1', '1', 'MFNShipment', '2021-04-16 04:02:18', 'DurgeshPandey', 10, 2, 2021, '2021-02-10'),
(645, '2/25/2021', 'Ahilya', 'Adarsh Singh', 'Amazon', '1', '1', 'MFNShipment', '2021-04-16 04:02:18', 'AdarshSingh', 25, 2, 2021, '2021-02-25'),
(646, '1/21/2021', 'Ishq E Namah', 'Pradeep Chaturvedi', 'Amazon', '-1', '1', 'Refund', '2021-04-16 04:02:18', 'PradeepChaturvedi', 21, 1, 2021, '2021-01-21'),
(647, '1/28/2021', 'Gandhi Haar Gaye', 'Durgesh Pandey', 'Amazon', '1', '1', 'MFNShipment', '2021-04-16 04:02:18', 'DurgeshPandey', 28, 1, 2021, '2021-01-28'),
(648, '1/28/2021', 'Gandhi Haar Gaye', 'Durgesh Pandey', 'Amazon', '1', '1', 'MFNShipment', '2021-04-16 04:02:18', 'DurgeshPandey', 28, 1, 2021, '2021-01-28'),
(649, '1/29/2021', 'Gandhi Haar Gaye', 'Durgesh Pandey', 'Amazon', '1', '1', 'MFNShipment', '2021-04-16 04:02:18', 'DurgeshPandey', 29, 1, 2021, '2021-01-29'),
(650, '1/29/2021', 'Gandhi Haar Gaye', 'Durgesh Pandey', 'Amazon', '1', '1', 'MFNShipment', '2021-04-16 04:02:18', 'DurgeshPandey', 29, 1, 2021, '2021-01-29'),
(651, '1/30/2021', 'Gandhi Haar Gaye', 'Durgesh Pandey', 'Amazon', '1', '1', 'MFNShipment', '2021-04-16 04:02:18', 'DurgeshPandey', 30, 1, 2021, '2021-01-30'),
(652, '1/30/2021', 'Gandhi Haar Gaye', 'Durgesh Pandey', 'Amazon', '1', '1', 'MFNShipment', '2021-04-16 04:02:18', 'DurgeshPandey', 30, 1, 2021, '2021-01-30'),
(653, '1/31/2021', 'Gandhi Haar Gaye', 'Durgesh Pandey', 'Amazon', '1', '1', 'MFNShipment', '2021-04-16 04:02:18', 'DurgeshPandey', 31, 1, 2021, '2021-01-31'),
(654, '1/31/2021', 'Gandhi Haar Gaye', 'Durgesh Pandey', 'Amazon', '1', '1', 'MFNShipment', '2021-04-16 04:02:18', 'DurgeshPandey', 31, 1, 2021, '2021-01-31'),
(655, '1/31/2021', 'Gandhi Haar Gaye', 'Durgesh Pandey', 'Amazon', '1', '1', 'MFNShipment', '2021-04-16 04:02:18', 'DurgeshPandey', 31, 1, 2021, '2021-01-31'),
(656, '1/31/2021', 'Gandhi Haar Gaye', 'Durgesh Pandey', 'Amazon', '1', '1', 'MFNShipment', '2021-04-16 04:02:18', 'DurgeshPandey', 31, 1, 2021, '2021-01-31'),
(657, '1/31/2021', 'Gandhi Haar Gaye', 'Durgesh Pandey', 'Amazon', '1', '1', 'MFNShipment', '2021-04-16 04:02:18', 'DurgeshPandey', 31, 1, 2021, '2021-01-31'),
(658, '3/3/2021', '1987 Ek Kahani Aise Bhi', 'Prof Mahendra Shirsath', 'Amazon', '2', '2', 'MFNShipment', '2021-04-16 04:02:18', 'ProfMahendraShirsath', 3, 3, 2021, '2021-03-03'),
(659, '3/5/2021', 'DECODER For UPSC Mains', 'Rahul Singh', 'Amazon', '1', '1', 'MFNShipment', '2021-04-16 04:02:18', 'RahulSingh', 5, 3, 2021, '2021-03-05'),
(660, '3/7/2021', 'ONCE UPON A TIME IN 2020    The Lockdown Diaries ', 'Manya Harsha', 'Amazon', '1', '1', 'MFNShipment', '2021-04-16 04:02:18', 'ManyaHarsha', 7, 3, 2021, '2021-03-07'),
(661, '3/8/2021', 'DECODER For UPSC Mains', 'Rahul Singh', 'Amazon', '1', '1', 'MFNShipment', '2021-04-16 04:02:18', 'RahulSingh', 8, 3, 2021, '2021-03-08'),
(662, '3/13/2021', 'Gandhi Haar Gaye', 'Durgesh Pandey', 'Amazon', '1', '1', 'MFNShipment', '2021-04-16 04:02:18', 'DurgeshPandey', 13, 3, 2021, '2021-03-13'),
(663, '3/14/2021', 'Gandhi Haar Gaye', 'Durgesh Pandey', 'Amazon', '1', '1', 'MFNShipment', '2021-04-16 04:02:18', 'DurgeshPandey', 14, 3, 2021, '2021-03-14'),
(664, '3/14/2021', 'Gandhi Haar Gaye', 'Durgesh Pandey', 'Amazon', '1', '1', 'MFNShipment', '2021-04-16 04:02:18', 'DurgeshPandey', 14, 3, 2021, '2021-03-14'),
(665, '3/15/2021', 'Gandhi Haar Gaye', 'Durgesh Pandey', 'Amazon', '1', '1', 'MFNShipment', '2021-04-16 04:02:18', 'DurgeshPandey', 15, 3, 2021, '2021-03-15'),
(666, '3/14/2021', 'Gandhi Haar Gaye', 'Durgesh Pandey', 'Amazon', '1', '1', 'MFNShipment', '2021-04-16 04:02:18', 'DurgeshPandey', 14, 3, 2021, '2021-03-14'),
(667, '3/13/2021', 'Gandhi Haar Gaye', 'Durgesh Pandey', 'Amazon', '1', '1', 'MFNShipment', '2021-04-16 04:02:18', 'DurgeshPandey', 13, 3, 2021, '2021-03-13'),
(668, '3/15/2021', 'Gandhi Haar Gaye', 'Durgesh Pandey', 'Amazon', '1', '1', 'MFNShipment', '2021-04-16 04:02:18', 'DurgeshPandey', 15, 3, 2021, '2021-03-15'),
(669, '3/12/2021', 'Gandhi Haar Gaye', 'Durgesh Pandey', 'Amazon', '1', '1', 'MFNShipment', '2021-04-16 04:02:18', 'DurgeshPandey', 12, 3, 2021, '2021-03-12'),
(670, '3/17/2021', 'Jeevan Ke Kuch Adbhut Pal', 'Dinesh Sahay', 'Amazon', '1', '1', 'MFNShipment', '2021-04-16 04:02:18', 'DineshSahay', 17, 3, 2021, '2021-03-17'),
(671, '3/18/2021', 'Gandhi Haar Gaye', 'Durgesh Pandey', 'Amazon', '1', '1', 'MFNShipment', '2021-04-16 04:02:18', 'DurgeshPandey', 18, 3, 2021, '2021-03-18'),
(672, '3/19/2021', 'Gandhi Haar Gaye', 'Durgesh Pandey', 'Amazon', '1', '1', 'MFNShipment', '2021-04-16 04:02:18', 'DurgeshPandey', 19, 3, 2021, '2021-03-19'),
(673, '3/21/2021', 'Gandhi Haar Gaye', 'Durgesh Pandey', 'Amazon', '1', '1', 'MFNShipment', '2021-04-16 04:02:18', 'DurgeshPandey', 21, 3, 2021, '2021-03-21'),
(674, '3/21/2021', 'Gandhi Haar Gaye', 'Durgesh Pandey', 'Amazon', '1', '1', 'MFNShipment', '2021-04-16 04:02:18', 'DurgeshPandey', 21, 3, 2021, '2021-03-21'),
(675, '3/20/2021', 'Gandhi Haar Gaye', 'Durgesh Pandey', 'Amazon', '1', '1', 'MFNShipment', '2021-04-16 04:02:18', 'DurgeshPandey', 20, 3, 2021, '2021-03-20'),
(676, '3/21/2021', 'Gandhi Haar Gaye', 'Durgesh Pandey', 'Amazon', '1', '1', 'MFNShipment', '2021-04-16 04:02:18', 'DurgeshPandey', 21, 3, 2021, '2021-03-21'),
(677, '3/21/2021', 'Gandhi Haar Gaye', 'Durgesh Pandey', 'Amazon', '1', '1', 'MFNShipment', '2021-04-16 04:02:18', 'DurgeshPandey', 21, 3, 2021, '2021-03-21'),
(678, '3/22/2021', 'Gandhi Haar Gaye', 'Durgesh Pandey', 'Amazon', '1', '1', 'MFNShipment', '2021-04-16 04:02:18', 'DurgeshPandey', 22, 3, 2021, '2021-03-22'),
(679, '3/23/2021', 'Gandhi Haar Gaye', 'Durgesh Pandey', 'Amazon', '1', '1', 'MFNShipment', '2021-04-16 04:02:18', 'DurgeshPandey', 23, 3, 2021, '2021-03-23'),
(680, '3/23/2021', 'Gandhi Haar Gaye', 'Durgesh Pandey', 'Amazon', '1', '1', 'MFNShipment', '2021-04-16 04:02:18', 'DurgeshPandey', 23, 3, 2021, '2021-03-23'),
(681, '3/20/2021', 'DECODER For UPSC Mains', 'Rahul Singh', 'Amazon', '1', '1', 'MFNShipment', '2021-04-16 04:02:18', 'RahulSingh', 20, 3, 2021, '2021-03-20'),
(682, '3/24/2021', 'Gandhi Haar Gaye', 'Durgesh Pandey', 'Amazon', '1', '1', 'MFNShipment', '2021-04-16 04:02:18', 'DurgeshPandey', 24, 3, 2021, '2021-03-24'),
(683, '3/24/2021', 'Gandhi Haar Gaye', 'Durgesh Pandey', 'Amazon', '1', '1', 'MFNShipment', '2021-04-16 04:02:18', 'DurgeshPandey', 24, 3, 2021, '2021-03-24'),
(684, '3/25/2021', 'Life Through My Eyes', 'Sumana .', 'Amazon', '1', '1', 'MFNShipment', '2021-04-16 04:02:18', 'SumanaAcherjeeMukherjee', 25, 3, 2021, '2021-03-25'),
(685, '3/25/2021', 'Story of Bed No  24', 'Nitish Gautam', 'Amazon', '1', '1', 'MFNShipment', '2021-04-16 04:02:18', 'NitishGautam', 25, 3, 2021, '2021-03-25'),
(686, '3/26/2021', 'Gandhi Haar Gaye', 'Durgesh Pandey', 'Amazon', '1', '1', 'MFNShipment', '2021-04-16 04:02:18', 'DurgeshPandey', 26, 3, 2021, '2021-03-26'),
(687, '3/26/2021', 'Gandhi Haar Gaye', 'Durgesh Pandey', 'Amazon', '1', '1', 'MFNShipment', '2021-04-16 04:02:18', 'DurgeshPandey', 26, 3, 2021, '2021-03-26'),
(688, '3/29/2021', 'Gandhi Haar Gaye', 'Durgesh Pandey', 'Amazon', '1', '1', 'MFNShipment', '2021-04-16 04:02:19', 'DurgeshPandey', 29, 3, 2021, '2021-03-29'),
(689, '3/26/2021', 'Gandhi Haar Gaye', 'Durgesh Pandey', 'Amazon', '1', '1', 'MFNShipment', '2021-04-16 04:02:19', 'DurgeshPandey', 26, 3, 2021, '2021-03-26'),
(690, '3/27/2021', 'Gandhi Haar Gaye', 'Durgesh Pandey', 'Amazon', '1', '1', 'MFNShipment', '2021-04-16 04:02:19', 'DurgeshPandey', 27, 3, 2021, '2021-03-27'),
(691, '3/26/2021', 'A Dastae', 'Kafir .', 'Amazon', '1', '1', 'MFNShipment', '2021-04-16 04:02:19', 'Kafir.', 26, 3, 2021, '2021-03-26'),
(692, '3/23/2021', 'I Value You', 'Polankey Eshwar Kumar', 'Amazon', '1', '1', 'MFNShipment', '2021-04-16 04:02:19', 'PolankeyEshwarKumar', 23, 3, 2021, '2021-03-23'),
(693, '3/26/2021', 'DECODER For UPSC Mains', 'Rahul Singh', 'Amazon', '1', '1', 'MFNShipment', '2021-04-16 04:02:19', 'RahulSingh', 26, 3, 2021, '2021-03-26'),
(694, '3/29/2021', 'Organizational Management for Non-Government Organisations', 'Nikhil Naskar', 'Amazon', '1', '1', 'MFNShipment', '2021-04-16 04:02:19', '', 29, 3, 2021, '2021-03-29'),
(695, '3/29/2021', 'The Red Plague', '', 'Amazon', '1', '1', 'MFNShipment', '2021-04-16 04:02:19', '', 29, 3, 2021, '2021-03-29'),
(696, '3/31/2021', 'Gandhi Haar Gaye', 'Durgesh Pandey', 'Amazon', '1', '1', 'MFNShipment', '2021-04-16 04:02:19', 'DurgeshPandey', 31, 3, 2021, '2021-03-31'),
(697, '3/31/2021', 'Gandhi Haar Gaye', 'Durgesh Pandey', 'Amazon', '1', '1', 'MFNShipment', '2021-04-16 04:02:19', 'DurgeshPandey', 31, 3, 2021, '2021-03-31'),
(698, '3/30/2021', 'Gandhi Haar Gaye', 'Durgesh Pandey', 'Amazon', '1', '1', 'MFNShipment', '2021-04-16 04:02:19', 'DurgeshPandey', 30, 3, 2021, '2021-03-30'),
(699, '3/31/2021', 'Gandhi Haar Gaye', 'Durgesh Pandey', 'Amazon', '1', '1', 'MFNShipment', '2021-04-16 04:02:19', 'DurgeshPandey', 31, 3, 2021, '2021-03-31'),
(700, '3/18/2021', 'DECODER For UPSC Mains', 'Rahul Singh', 'Flipkart', '-1', '1', 'CANCELLED', '2021-04-16 04:02:25', 'RahulSingh', 18, 3, 2021, '2021-03-18'),
(701, '3/2/2021', 'DECODER For UPSC Mains', 'Rahul Singh', 'Flipkart', '-1', '1', 'CANCELLED', '2021-04-16 04:02:25', 'RahulSingh', 2, 3, 2021, '2021-03-02'),
(702, '3/23/2021', 'Gandhi Haar Gaye', 'Durgesh Pandey', 'Flipkart', '1', '1', 'DELIVERED', '2021-04-16 04:02:25', 'DurgeshPandey', 23, 3, 2021, '2021-03-23'),
(703, '3/23/2021', 'Gandhi Haar Gaye', 'Durgesh Pandey', 'Flipkart', '1', '1', 'DELIVERED', '2021-04-16 04:02:25', 'DurgeshPandey', 23, 3, 2021, '2021-03-23'),
(704, '3/26/2021', 'Gandhi Haar Gaye', 'Durgesh Pandey', 'Flipkart', '1', '1', 'DELIVERED', '2021-04-16 04:02:25', 'DurgeshPandey', 26, 3, 2021, '2021-03-26'),
(705, '3/26/2021', 'Gandhi Haar Gaye', 'Durgesh Pandey', 'Flipkart', '1', '1', 'DELIVERED', '2021-04-16 04:02:25', 'DurgeshPandey', 26, 3, 2021, '2021-03-26'),
(706, '3/14/2021', 'Gandhi Haar Gaye', 'Durgesh Pandey', 'Flipkart', '1', '1', 'DELIVERED', '2021-04-16 04:02:25', 'DurgeshPandey', 14, 3, 2021, '2021-03-14'),
(707, '3/19/2021', 'DECODER For UPSC Mains', 'Rahul Singh', 'Flipkart', '1', '1', 'READY_TO_SHIP', '2021-04-16 04:02:25', 'RahulSingh', 19, 3, 2021, '2021-03-19'),
(708, '3/3/2021', '1987 Ek Kahani Aise Bhi', 'Prof Mahendra Shirsath', 'Flipkart', '-1', '1', 'CANCELLED', '2021-04-16 04:02:25', 'ProfMahendraShirsath', 3, 3, 2021, '2021-03-03'),
(709, '3/13/2021', 'Gandhi Haar Gaye', 'Durgesh Pandey', 'Flipkart', '1', '1', 'DELIVERED', '2021-04-16 04:02:25', 'DurgeshPandey', 13, 3, 2021, '2021-03-13'),
(710, '2021-30-03', 'SHAPE YOUR THINKING  A Guide for Survival  Success in 21st Century', 'SHASHANK  MUTNEJA', 'KDP', '1', '1', '', '2021-04-16 05:20:10', 'SHASHANKMUTNEJA', 3, 2021, 30, '2021-03-30'),
(711, '2021-30-03', 'STORY OF BED NO.24', 'Nitish Gautam', 'KDP', '1', '1', '', '2021-04-16 05:20:10', 'NitishGautam', 3, 2021, 30, '2021-03-30'),
(712, '2021-30-03', 'Deeper into Dark-o Clock', 'Nimra Ahmad', 'KDP', '1', '1', '', '2021-04-16 05:20:10', 'NimraAhmad', 3, 2021, 30, '2021-03-30'),
(713, '2021-29-03', 'Organizational Management for Non-Government Organisations', 'Nikhil  Naskar', 'KDP', '1', '1', '', '2021-04-16 05:20:10', 'NikhilNaskar', 3, 2021, 29, '2021-03-29'),
(714, '2021-27-03', 'My New unexpected Life In Another World, Volume-1', 'Parvesh  Kumar', 'KDP', '1', '1', '', '2021-04-16 05:20:10', 'ParveshKumar', 3, 2021, 27, '2021-03-27'),
(715, '2021-25-03', 'SHAPE YOUR THINKING  A Guide for Survival  Success in 21st Century', 'SHASHANK  MUTNEJA', 'KDP', '1', '1', '', '2021-04-16 05:20:10', 'SHASHANKMUTNEJA', 3, 2021, 25, '2021-03-25'),
(716, '2021-25-03', 'Rafoo', 'Ra. Mu. Gaygol', 'KDP', '1', '1', '', '2021-04-16 05:20:10', 'Ra.Mu.Gaygol', 3, 2021, 25, '2021-03-25'),
(717, '2021-24-03', 'ANANT SAMBHAVNA : (Traits for Infinite Success Possibilities)', 'Anant  Agrawal', 'KDP', '1', '1', '', '2021-04-16 05:20:10', 'AnantAgrawal', 3, 2021, 24, '2021-03-24'),
(718, '2021-20-03', '&quot;Percipience&quot;,&quot; Poetry To Perceive&quot;', 'Antara Roy  Bhattacharjee', 'KDP', '1', '1', '', '2021-04-16 05:20:10', 'AntaraRoyBhattacharjee', 3, 2021, 20, '2021-03-20'),
(719, '2021-19-03', 'The Last Sigh', 'Swapnil .', 'KDP', '1', '1', '', '2021-04-16 05:20:10', 'Swapnil.', 3, 2021, 19, '2021-03-19'),
(720, '2021-19-03', 'Scribblings From A Travellers Diary', 'Methil S Vijayaraghavan', 'KDP', '1', '1', '', '2021-04-16 05:20:10', 'MethilSVijayaraghavan', 3, 2021, 19, '2021-03-19'),
(721, '2021-18-03', 'OBJECT + IF = I', 'Nilshree  Atish Yelulkar', 'KDP', '1', '1', '', '2021-04-16 05:20:10', 'NilshreeAtishYelulkar', 3, 2021, 18, '2021-03-18'),
(722, '2021-16-03', '&quot;Percipience&quot;,&quot; Poetry To Perceive&quot;', 'Antara Roy  Bhattacharjee', 'KDP', '1', '1', '', '2021-04-16 05:20:10', 'AntaraRoyBhattacharjee', 3, 2021, 16, '2021-03-16'),
(723, '2021-15-03', 'SHAPE YOUR THINKING  A Guide for Survival  Success in 21st Century', 'SHASHANK  MUTNEJA', 'KDP', '2', '2', '', '2021-04-16 05:20:10', 'SHASHANKMUTNEJA', 3, 2021, 15, '2021-03-15'),
(724, '2021-12-03', 'SHAPE YOUR THINKING  A Guide for Survival  Success in 21st Century', 'SHASHANK  MUTNEJA', 'KDP', '1', '1', '', '2021-04-16 05:20:10', 'SHASHANKMUTNEJA', 3, 2021, 12, '2021-03-12'),
(725, '2021-12-03', 'OBJECT + IF = I', 'Nilshree  Atish Yelulkar', 'KDP', '1', '1', '', '2021-04-16 05:20:10', 'NilshreeAtishYelulkar', 3, 2021, 12, '2021-03-12'),
(726, '2021-12-03', '&quot;Percipience&quot;,&quot; Poetry To Perceive&quot;', 'Antara Roy  Bhattacharjee', 'KDP', '1', '1', '', '2021-04-16 05:20:10', 'AntaraRoyBhattacharjee', 3, 2021, 12, '2021-03-12'),
(727, '2021-11-03', '&quot;Percipience&quot;,&quot; Poetry To Perceive&quot;', 'Antara Roy  Bhattacharjee', 'KDP', '1', '1', '', '2021-04-16 05:20:10', 'AntaraRoyBhattacharjee', 3, 2021, 11, '2021-03-11'),
(728, '2021-10-03', 'Baagicha-E-Ghazal', 'Ronak  H Bhavsar', 'KDP', '1', '1', '', '2021-04-16 05:20:10', 'RonakHBhavsar', 3, 2021, 10, '2021-03-10'),
(729, '2021-10-03', 'Deeper into Dark-o Clock', 'Nimra Ahmad', 'KDP', '1', '1', '', '2021-04-16 05:20:10', 'NimraAhmad', 3, 2021, 10, '2021-03-10'),
(730, '2021-09-03', 'Everlasting Magical Echoes', 'Dr. Kiran Prabhakar  Rebello', 'KDP', '4', '4', '', '2021-04-16 05:20:10', 'Dr.KiranPrabhakarRebello', 3, 2021, 9, '2021-03-09'),
(731, '2021-06-03', 'The Red Plague', 'Sri Harsha Gajavalli', 'KDP', '1', '1', '', '2021-04-16 05:20:10', 'SriHarshaGajavalli', 3, 2021, 6, '2021-03-06'),
(732, '2021-05-03', 'Life Through My Eyes', 'Sumana .', 'KDP', '1', '1', '', '2021-04-16 05:20:10', 'SumanaAcherjeeMukherjee', 3, 2021, 5, '2021-03-05'),
(733, '2021-05-03', 'Baagicha-E-Ghazal', 'Ronak  H Bhavsar', 'KDP', '1', '1', '', '2021-04-16 05:20:10', 'RonakHBhavsar', 3, 2021, 5, '2021-03-05'),
(734, '2021-05-03', 'Jeevan Ke Kuch Adbhut Pal', 'Dinesh  Sahay', 'KDP', '2', '2', '', '2021-04-16 05:20:10', 'DineshSahay', 3, 2021, 5, '2021-03-05'),
(735, '2021-04-03', 'Jeevan Ke Kuch Adbhut Pal', 'Dinesh  Sahay', 'KDP', '1', '1', '', '2021-04-16 05:20:10', 'DineshSahay', 3, 2021, 4, '2021-03-04'),
(736, '2021-04-03', 'OBJECT + IF = I', 'Nilshree  Atish Yelulkar', 'KDP', '1', '1', '', '2021-04-16 05:20:10', 'NilshreeAtishYelulkar', 3, 2021, 4, '2021-03-04'),
(737, '2021-04-03', 'ANANT SAMBHAVNA : (Traits for Infinite Success Possibilities)', 'Anant  Agrawal', 'KDP', '0', '0', '', '2021-04-16 05:20:10', 'AnantAgrawal', 3, 2021, 4, '2021-03-04'),
(738, '2021-04-03', 'Hindu Raashtra Bharat Ke Naye Samvidhaan Ki Roop Rekha', 'Mr. Virendra  Samvidhaan', 'KDP', '1', '1', '', '2021-04-16 05:20:10', 'Mr.VirendraSamvidhaan', 3, 2021, 4, '2021-03-04'),
(739, '2021-03-03', 'Tunnel Construction - A Practical Approach Demystified', 'Dr. Ashok  Kumar Sharma', 'KDP', '1', '1', '', '2021-04-16 05:20:10', 'Dr.AshokKumarSharma', 3, 2021, 3, '2021-03-03'),
(740, '2021-03-03', 'Baagicha-E-Ghazal', 'Ronak  H Bhavsar', 'KDP', '1', '1', '', '2021-04-16 05:20:10', 'RonakHBhavsar', 3, 2021, 3, '2021-03-03'),
(741, '2021-03-03', 'ANANT SAMBHAVNA : (Traits for Infinite Success Possibilities)', 'Anant  Agrawal', 'KDP', '1', '1', '', '2021-04-16 05:20:10', 'AnantAgrawal', 3, 2021, 3, '2021-03-03'),
(742, '2021-02-03', 'SHAPE YOUR THINKING  A Guide for Survival  Success in 21st Century', 'SHASHANK  MUTNEJA', 'KDP', '1', '1', '', '2021-04-16 05:20:10', 'SHASHANKMUTNEJA', 3, 2021, 2, '2021-03-02'),
(743, '2/3/2021', '1987 Ek Kahani Aise Bhi', 'Prof. Mahendra  Shirsath', 'KDP', '1', '1', '', '2021-04-16 05:20:10', 'ProfMahendraShirsath', 3, 2021, 2, '2021-03-02'),
(744, '2021-01-03', 'Veerangee', 'Ajay  Mohan', 'KDP', '1', '1', '', '2021-04-16 05:20:10', 'AjayMohan', 3, 2021, 1, '2021-03-01'),
(745, '2021-29-03', 'Organizational Management for Non-Government Organisations', 'Nikhil Naskar', 'Amazon', '1', '1', NULL, '2021-04-20 10:41:56', 'NikhilNaskar', 3, 2021, 29, '2021-03-29'),
(746, '2021-29-04', 'Jeevan Ke Kuch Adbhut Pal', 'Dinesh  Sahay', 'KDP', '1', '1', '', '2021-05-17 08:13:45', 'DineshSahay', 4, 2021, 29, '2021-04-29'),
(747, '2021-29-04', 'Organizational Management for Non-Government Organisations', 'Nikhil  Naskar', 'KDP', '1', '1', '', '2021-05-17 08:13:45', 'NikhilNaskar', 4, 2021, 29, '2021-04-29'),
(748, '2021-28-04', 'Dragon Rider', 'Zarah  Faiz', 'KDP', '1', '1', '', '2021-05-17 08:13:45', 'ZarahFaiz', 4, 2021, 28, '2021-04-28'),
(749, '2021-26-04', 'Kavit', 'Kaustubh Prabhakar  Gogate', 'KDP', '1', '1', '', '2021-05-17 08:13:45', 'KaustubhPrabhakarGogate', 4, 2021, 26, '2021-04-26'),
(750, '2021-25-04', 'Veerangee', 'Ajay  Mohan', 'KDP', '1', '1', '', '2021-05-17 08:13:45', 'AjayMohan', 4, 2021, 25, '2021-04-25'),
(751, '2021-25-04', 'Natural Beauty Secrets', 'Monisha Sarage', 'KDP', '1', '1', '', '2021-05-17 08:13:45', 'MonishaKetanSarage', 4, 2021, 25, '2021-04-25'),
(752, '2021-23-04', 'SHAPE YOUR THINKING : A Guide for Survival &amp; Success in 21st Century', 'SHASHANK  MUTNEJA', 'KDP', '1', '1', '', '2021-05-17 08:13:45', 'SHASHANKMUTNEJA', 4, 2021, 23, '2021-04-23'),
(753, '2021-23-04', 'Natural Beauty Secrets', 'Monisha Sarage', 'KDP', '1', '1', '', '2021-05-17 08:13:45', 'MonishaKetanSarage', 4, 2021, 23, '2021-04-23'),
(754, '2021-22-04', 'Natural Beauty Secrets', 'Monisha Sarage', 'KDP', '2', '2', '', '2021-05-17 08:13:45', 'MonishaKetanSarage', 4, 2021, 22, '2021-04-22'),
(755, '2021-21-04', 'Natural Beauty Secrets', 'Monisha Sarage', 'KDP', '3', '3', '', '2021-05-17 08:13:45', 'MonishaKetanSarage', 4, 2021, 21, '2021-04-21'),
(756, '2021-17-04', 'SHAPE YOUR THINKING : A Guide for Survival &amp; Success in 21st Century', 'SHASHANK  MUTNEJA', 'KDP', '1', '1', '', '2021-05-17 08:13:45', 'SHASHANKMUTNEJA', 4, 2021, 17, '2021-04-17'),
(757, '2021-16-04', 'Kavit', 'Kaustubh Prabhakar  Gogate', 'KDP', '1', '1', '', '2021-05-17 08:13:45', 'KaustubhPrabhakarGogate', 4, 2021, 16, '2021-04-16'),
(758, '2021-15-04', 'SHAPE YOUR THINKING : A Guide for Survival &amp; Success in 21st Century', 'SHASHANK  MUTNEJA', 'KDP', '1', '1', '', '2021-05-17 08:13:45', 'SHASHANKMUTNEJA', 4, 2021, 15, '2021-04-15'),
(759, '2021-15-04', 'Dragon Rider', 'Zarah  Faiz', 'KDP', '1', '1', '', '2021-05-17 08:13:45', 'ZarahFaiz', 4, 2021, 15, '2021-04-15'),
(760, '2021-15-04', 'Kavit', 'Kaustubh Prabhakar  Gogate', 'KDP', '5', '5', '', '2021-05-17 08:13:45', 'KaustubhPrabhakarGogate', 4, 2021, 15, '2021-04-15'),
(761, '2021-14-04', 'SHAPE YOUR THINKING : A Guide for Survival &amp; Success in 21st Century', 'SHASHANK  MUTNEJA', 'KDP', '1', '1', '', '2021-05-17 08:13:45', 'SHASHANKMUTNEJA', 4, 2021, 14, '2021-04-14'),
(762, '2021-14-04', 'Kavit', 'Kaustubh Prabhakar  Gogate', 'KDP', '1', '1', '', '2021-05-17 08:13:45', 'KaustubhPrabhakarGogate', 4, 2021, 14, '2021-04-14'),
(763, '2021-13-04', 'Punch of Positivity', 'Saurabhi  Shahi', 'KDP', '1', '1', '', '2021-05-17 08:13:45', 'SaurabhiShahi', 4, 2021, 13, '2021-04-13'),
(764, '2021-12-04', 'SHAPE YOUR THINKING : A Guide for Survival &amp; Success in 21st Century', 'SHASHANK  MUTNEJA', 'KDP', '1', '1', '', '2021-05-17 08:13:45', 'SHASHANKMUTNEJA', 4, 2021, 12, '2021-04-12'),
(765, '2021-11-04', 'Natural Beauty Secrets', 'Monisha Sarage', 'KDP', '1', '1', '', '2021-05-17 08:13:45', 'MonishaKetanSarage', 4, 2021, 11, '2021-04-11'),
(766, '2021-09-04', 'SHAPE YOUR THINKING : A Guide for Survival &amp; Success in 21st Century', 'SHASHANK  MUTNEJA', 'KDP', '1', '1', '', '2021-05-17 08:13:45', 'SHASHANKMUTNEJA', 4, 2021, 9, '2021-04-09'),
(767, '2021-09-04', 'Speaking English Confidently And Effortlessly', 'Dr Arun  Behera', 'KDP', '1', '1', '', '2021-05-17 08:13:45', 'DrArunBehera', 4, 2021, 9, '2021-04-09'),
(768, '2021-08-04', 'Everlasting Magical Echoes', 'Dr. Kiran Prabhakar  Rebello', 'KDP', '1', '1', '', '2021-05-17 08:13:45', 'Dr.KiranPrabhakarRebello', 4, 2021, 8, '2021-04-08'),
(769, '2021-07-04', 'Everlasting Magical Echoes', 'Dr. Kiran Prabhakar  Rebello', 'KDP', '1', '1', '', '2021-05-17 08:13:45', 'Dr.KiranPrabhakarRebello', 4, 2021, 7, '2021-04-07'),
(770, '2021-07-04', 'Scribblings From A Travellers Diary', 'Methil S Vijayaraghavan', 'KDP', '1', '1', '', '2021-05-17 08:13:45', 'MethilSVijayaraghavan', 4, 2021, 7, '2021-04-07'),
(771, '2021-07-04', 'Dragon Rider', 'Zarah  Faiz', 'KDP', '1', '1', '', '2021-05-17 08:13:45', 'ZarahFaiz', 4, 2021, 7, '2021-04-07'),
(772, '2021-07-04', 'Deeper into Dark-o Clock', 'Nimra Ahmad', 'KDP', '1', '1', '', '2021-05-17 08:13:45', 'NimraAhmad', 4, 2021, 7, '2021-04-07'),
(773, '2021-06-04', '&quot;Percipience&quot;,&quot; Poetry To Perceive&quot;', 'Antara Roy  Bhattacharjee', 'KDP', '1', '1', '', '2021-05-17 08:13:45', 'AntaraRoyBhattacharjee', 4, 2021, 6, '2021-04-06'),
(774, '2021-05-04', 'Venus Lion', 'Vaishnavi  Jori', 'KDP', '2', '2', '', '2021-05-17 08:13:45', 'VaishnaviJori', 4, 2021, 5, '2021-04-05'),
(775, '2021-04-04', 'Natural Beauty Secrets', 'Monisha Sarage', 'KDP', '1', '1', '', '2021-05-17 08:13:45', 'MonishaKetanSarage', 4, 2021, 4, '2021-04-04'),
(776, '2021-03-04', 'Natural Beauty Secrets', 'Monisha Sarage', 'KDP', '5', '5', '', '2021-05-17 08:13:45', 'MonishaKetanSarage', 4, 2021, 3, '2021-04-03'),
(777, '2021-02-04', 'Venus Lion', 'Vaishnavi  Jori', 'KDP', '1', '1', '', '2021-05-17 08:13:45', 'VaishnaviJori', 4, 2021, 2, '2021-04-02'),
(778, '2021-02-04', 'Venus Lion', 'Vaishnavi  Jori', 'KDP', '1', '1', '', '2021-05-17 08:13:45', 'VaishnaviJori', 4, 2021, 2, '2021-04-02'),
(779, '2021-02-04', 'Venus Lion', 'Vaishnavi  Jori', 'KDP', '1', '1', '', '2021-05-17 08:13:45', 'VaishnaviJori', 4, 2021, 2, '2021-04-02'),
(780, '2021-02-04', 'Venus Lion', 'Vaishnavi  Jori', 'KDP', '1', '1', '', '2021-05-17 08:13:45', 'VaishnaviJori', 4, 2021, 2, '2021-04-02'),
(795, '04/02/2021', 'BRAHMASTRA-The Weapon Saviour For ICSE Computer Applications', 'Santosh Kumar and Shalini Shikha', 'GooglePlay', '1', '1', '', '2021-05-17 09:01:40', 'SantoshKumarandShaliniShikha', 2, 4, 2021, '2021-04-02'),
(796, '04/04/2021', 'Natural Beauty Secrets', 'Monisha Sarage', 'GooglePlay', '1', '1', '', '2021-05-17 09:01:40', 'MonishaKetanSarage', 4, 4, 2021, '2021-04-04'),
(797, '04/10/2021', 'Mere Alfaz', 'Shashikant Verma', 'GooglePlay', '1', '1', '', '2021-05-17 09:01:40', 'ShashikantVerma', 10, 4, 2021, '2021-04-10'),
(798, '04/10/2021', 'Mere Alfaz', 'Shashikant Verma', 'GooglePlay', '1', '1', '', '2021-05-17 09:01:40', 'ShashikantVerma', 10, 4, 2021, '2021-04-10'),
(799, '04/10/2021', 'Mere Alfaz', 'Shashikant Verma', 'GooglePlay', '1', '1', '', '2021-05-17 09:01:40', 'ShashikantVerma', 10, 4, 2021, '2021-04-10'),
(800, '04/17/2021', 'Mere Alfaz', 'Shashikant Verma', 'GooglePlay', '1', '1', '', '2021-05-17 09:01:40', 'ShashikantVerma', 17, 4, 2021, '2021-04-17'),
(801, '04/17/2021', 'Kahi Unkahi Samvedana', 'Asha Dileep', 'GooglePlay', '1', '1', '', '2021-05-17 09:01:40', 'AshaDileep', 17, 4, 2021, '2021-04-17'),
(802, '04/20/2021', 'Rishte', 'Prem Sharma', 'GooglePlay', '1', '1', '', '2021-05-17 09:01:40', 'PremSharma', 20, 4, 2021, '2021-04-20'),
(803, '04/20/2021', 'Rishte', 'Prem Sharma', 'GooglePlay', '1', '1', '', '2021-05-17 09:01:40', 'PremSharma', 20, 4, 2021, '2021-04-20'),
(804, '04/20/2021', 'Rishte', 'Prem Sharma', 'GooglePlay', '1', '1', '', '2021-05-17 09:01:40', 'PremSharma', 20, 4, 2021, '2021-04-20'),
(805, '04/20/2021', 'Rishte', 'Prem Sharma', 'GooglePlay', '1', '1', '', '2021-05-17 09:01:40', 'PremSharma', 20, 4, 2021, '2021-04-20'),
(806, '04/20/2021', 'Rishte', 'Prem Sharma', 'GooglePlay', '1', '1', '', '2021-05-17 09:01:40', 'PremSharma', 20, 4, 2021, '2021-04-20'),
(807, '04/24/2021', 'Rishte', 'Prem Sharma', 'GooglePlay', '1', '1', '', '2021-05-17 09:01:40', 'PremSharma', 24, 4, 2021, '2021-04-24'),
(808, '04/28/2021', 'BRAHMASTRA-The Weapon Saviour For ICSE Computer Applications', 'Santosh Kumar and Shalini Shikha', 'GooglePlay', '1', '1', '', '2021-05-17 09:01:40', 'SantoshKumarandShaliniShikha', 28, 4, 2021, '2021-04-28'),
(809, '4/6/2021', 'Gandhi Haar Gaye', 'Durgesh Pandey', 'Amazon', '1', '1', 'MFNShipment', '2021-05-17 09:05:53', 'DurgeshPandey', 6, 4, 2021, '2021-04-06'),
(810, '4/6/2021', 'Madhubani Design Idea', 'Upasna Mishra', 'Amazon', '1', '1', 'MFNShipment', '2021-05-17 09:05:53', 'UpasnaMishra', 6, 4, 2021, '2021-04-06'),
(811, '4/6/2021', 'Story of Bed No  24', 'Nitish Gautam', 'Amazon', '1', '1', 'MFNShipment', '2021-05-17 09:05:53', 'NitishGautam', 6, 4, 2021, '2021-04-06'),
(812, '4/6/2021', 'Jeevan Ke Kuch Adbhut Pal', 'Dinesh Sahay', 'Amazon', '1', '1', 'MFNShipment', '2021-05-17 09:05:53', 'DineshSahay', 6, 4, 2021, '2021-04-06'),
(813, '4/6/2021', 'Organizational Management for Non-Government Organisations', 'Nikhil Naskar', 'Amazon', '1', '1', 'MFNShipment', '2021-05-17 09:05:53', 'NikhilNaskar', 6, 4, 2021, '2021-04-06'),
(814, '4/6/2021', 'Gandhi Haar Gaye', 'Durgesh Pandey', 'Amazon', '1', '1', 'MFNShipment', '2021-05-17 09:05:53', 'DurgeshPandey', 6, 4, 2021, '2021-04-06'),
(815, '4/6/2021', 'Ragunath Vinay Shatak', 'Manoj Tiwari', 'Amazon', '1', '1', 'MFNShipment', '2021-05-17 09:05:53', 'ManojTiwari', 6, 4, 2021, '2021-04-06'),
(816, '4/8/2021', 'Gandhi Haar Gaye', 'Durgesh Pandey', 'Amazon', '1', '1', 'MFNShipment', '2021-05-17 09:05:53', 'DurgeshPandey', 8, 4, 2021, '2021-04-08'),
(817, '4/8/2021', 'Gandhi Haar Gaye', 'Durgesh Pandey', 'Amazon', '1', '1', 'MFNShipment', '2021-05-17 09:05:53', 'DurgeshPandey', 8, 4, 2021, '2021-04-08'),
(818, '4/8/2021', 'PRE - Historic Animals', 'Sheela\'s', 'Amazon', '1', '1', 'MFNShipment', '2021-05-17 09:05:53', 'Sheela\'s', 8, 4, 2021, '2021-04-08'),
(819, '4/8/2021', 'DECODER For UPSC Mains', ' Rahul Singh', 'Amazon', '1', '1', 'MFNShipment', '2021-05-17 09:05:53', 'RahulSingh', 8, 4, 2021, '2021-04-08'),
(820, '4/9/2021', 'Everlasting Magical Echoes', 'Dr. Kiran Prabhakar Rebello', 'Amazon', '4', '4', 'MFNShipment', '2021-05-17 09:05:53', 'Dr.KiranPrabhakarRebello', 9, 4, 2021, '2021-04-09'),
(821, '4/9/2021', 'PRE   Historic Animals', 'Sheela\'s', 'Amazon', '1', '1', 'MFNShipment', '2021-05-17 09:05:53', 'Sheela\'s', 9, 4, 2021, '2021-04-09'),
(822, '4/9/2021', 'Everlasting Magical Echoes', 'Dr. Kiran Prabhakar Rebello', 'Amazon', '1', '1', 'MFNShipment', '2021-05-17 09:05:53', 'Dr.KiranPrabhakarRebello', 9, 4, 2021, '2021-04-09'),
(823, '4/9/2021', 'A Thought on Entrepreneurship   Leadership', 'Lokendra Pal Singh', 'Amazon', '1', '1', 'MFNShipment', '2021-05-17 09:05:53', 'LokendraPalSingh', 9, 4, 2021, '2021-04-09'),
(824, '4/10/2021', 'Gandhi Haar Gaye', 'Durgesh Pandey', 'Amazon', '1', '1', 'MFNShipment', '2021-05-17 09:05:53', 'DurgeshPandey', 10, 4, 2021, '2021-04-10'),
(825, '4/12/2021', 'Everlasting Magical Echoes', 'Dr. Kiran Prabhakar Rebello', 'Amazon', '1', '1', 'MFNShipment', '2021-05-17 09:05:53', 'Dr.KiranPrabhakarRebello', 12, 4, 2021, '2021-04-12'),
(826, '4/8/2021', 'DECODER For UPSC Mains', 'Rahul Singh', 'Amazon', '-1', '1', 'Refund', '2021-05-17 09:05:53', 'RahulSingh', 8, 4, 2021, '2021-04-08'),
(827, '4/13/2021', 'Deeper into Dark-o Clock', 'Nimra Ahmad', 'Amazon', '1', '1', 'MFNShipment', '2021-05-17 09:05:53', 'NimraAhmad', 13, 4, 2021, '2021-04-13'),
(828, '4/13/2021', 'Object   If   I', 'Nilshree Damani Yelulkar', 'Amazon', '1', '1', 'MFNShipment', '2021-05-17 09:05:53', 'NilshreeDamaniYelulkar', 13, 4, 2021, '2021-04-13'),
(829, '4/13/2021', 'Punch of Positivity', 'Saurabhi Shahi', 'Amazon', '1', '1', 'MFNShipment', '2021-05-17 09:05:53', 'SaurabhiShahi', 13, 4, 2021, '2021-04-13'),
(830, '4/14/2021', 'Gandhi Haar Gaye', 'Durgesh Pandey', 'Amazon', '1', '1', 'MFNShipment', '2021-05-17 09:05:53', 'DurgeshPandey', 14, 4, 2021, '2021-04-14'),
(831, '4/14/2021', 'Everlasting Magical Echoes', 'Dr. Kiran Prabhakar Rebello', 'Amazon', '1', '1', 'MFNShipment', '2021-05-17 09:05:53', 'Dr.KiranPrabhakarRebello', 14, 4, 2021, '2021-4-14'),
(832, '4/14/2021', 'Gandhi Haar Gaye', 'Durgesh Pandey', 'Amazon', '1', '1', 'MFNShipment', '2021-05-17 09:05:53', 'DurgeshPandey', 14, 4, 2021, '2021-04-14'),
(833, '4/16/2021', 'A Thought on Entrepreneurship   Leadership', 'Lokendra Pal Singh', 'Amazon', '1', '1', 'MFNShipment', '2021-05-17 09:05:53', 'LokendraPalSingh', 16, 4, 2021, '2021-04-16'),
(834, '4/16/2021', 'Object   If   I', 'Nilshree Damani Yelulkar', 'Amazon', '1', '1', 'MFNShipment', '2021-05-17 09:05:53', 'NilshreeDamaniYelulkar', 16, 4, 2021, '2021-4-16'),
(835, '4/13/2021', 'Object   If   I', 'Nilshree Damani Yelulkar', 'Amazon', '-1', '1', 'Refund', '2021-05-17 09:05:53', 'NilshreeDamaniYelulkar', 13, 4, 2021, '2021-4-13'),
(836, '4/20/2021', 'Life Through My Eyes', 'Sumana', 'Amazon', '1', '1', 'MFNShipment', '2021-05-17 09:05:53', 'Sumana', 20, 4, 2021, '2021-4-20'),
(837, '4/20/2021', 'Life Through My Eyes', 'Sumana', 'Amazon', '1', '1', 'MFNShipment', '2021-05-17 09:05:53', 'Sumana', 20, 4, 2021, '2021-4-20'),
(838, '4/20/2021', 'Scribblings From A Travellers Diary', 'Methil S Vijayaraghavan', 'Amazon', '1', '1', 'MFNShipment', '2021-05-17 09:05:53', 'MethilSVijayaraghavan', 20, 4, 2021, '2021-04-20'),
(839, '4/20/2021', 'A Thought on Entrepreneurship   Leadership', 'Lokendra Pal Singh', 'Amazon', '1', '1', 'MFNShipment', '2021-05-17 09:05:53', 'LokendraPalSingh', 20, 4, 2021, '2021-04-20'),
(840, '4/20/2021', 'A Thought on Entrepreneurship   Leadership', 'Lokendra Pal Singh', 'Amazon', '-1', '1', 'Refund', '2021-05-17 09:05:53', 'LokendraPalSingh', 20, 4, 2021, '2021-04-20'),
(841, '4/24/2021', 'Life Through My Eyes', 'Sumana', 'Amazon', '1', '1', 'MFNShipment', '2021-05-17 09:05:53', 'Sumana', 24, 4, 2021, '2021-4-24'),
(842, '4/27/2021', 'Demystifying R S S ', 'Anurag Saxena', 'Amazon', '1', '1', 'MFNShipment', '2021-05-17 09:05:53', 'AnuragSaxena', 27, 4, 2021, '2021-4-27'),
(843, '4/28/2021', 'Gandhi Haar Gaye', 'Durgesh Pandey', 'Amazon', '1', '1', 'MFNShipment', '2021-05-17 09:05:53', 'DurgeshPandey', 28, 4, 2021, '2021-04-28'),
(844, '4/30/2021', 'Tunnel Construction  A Practical Approach Demystified', 'Dr. A. K. Sharma', 'Amazon', '1', '1', 'MFNShipment', '2021-05-17 09:05:53', 'Dr.A.K.Sharma', 30, 4, 2021, '2021-4-30'),
(845, '4/30/2021', 'Kichad Mein Gulaab', 'Sadhna', 'Amazon', '1', '1', 'MFNShipment', '2021-05-17 09:05:53', 'Sadhna', 30, 4, 2021, '2021-4-30'),
(846, '4/3/2021', 'Ahilya', 'Adarsh Singh', 'Amazon', '1', '1', 'MFNShipment', '2021-05-17 09:05:53', 'AdarshSingh', 3, 4, 2021, '2021-4-3'),
(847, '3/31/2021', 'I Value You', 'Polankey Eshwar Kumar', 'Amazon', '-1', '1', 'Refund', '2021-05-17 09:05:53', 'PolankeyEshwarKumar', 31, 3, 2021, '2021-3-31'),
(848, '4/1/2021', 'Organizational Management for Non-Government Organisations', 'Nikhil Naskar', 'Amazon', '-1', '1', 'Refund', '2021-05-17 09:05:53', 'NikhilNaskar', 1, 4, 2021, '2021-04-01'),
(857, '4/18/2021', 'Gandhi Haar Gaye', 'Durgesh Pandey', 'Flipkart', '-1', '1', 'RETURN_REQUESTED', '2021-05-17 09:06:05', 'DurgeshPandey', 18, 4, 2021, '2021-04-18'),
(858, '4/18/2021', '1987 Ek Kahani Aise Bhi', 'Prof Mahendra Shirsath', 'Flipkart', '1', '1', 'DELIVERED', '2021-05-17 09:06:05', 'ProfMahendraShirsath', 18, 4, 2021, '2021-04-18'),
(859, '4/18/2021', 'Gandhi Haar Gaye', 'Durgesh Pandey', 'Flipkart', '1', '1', 'DELIVERED', '2021-05-17 09:06:05', 'DurgeshPandey', 18, 4, 2021, '2021-04-18'),
(860, '4/23/2021', 'Gandhi Haar Gaye', 'Durgesh Pandey', 'Flipkart', '1', '1', 'DELIVERED', '2021-05-17 09:06:05', 'DurgeshPandey', 23, 4, 2021, '2021-04-23'),
(861, '4/30/2021', 'Gandhi Haar Gaye', 'Durgesh Pandey', 'Flipkart', '1', '1', 'APPROVED', '2021-05-17 09:06:05', 'DurgeshPandey', 30, 4, 2021, '2021-04-30'),
(862, '4/30/2021', '1987 Ek Kahani Aise Bhi', 'Prof Mahendra Shirsath', 'Flipkart', '1', '1', 'APPROVED', '2021-05-17 09:06:05', 'ProfMahendraShirsath', 30, 4, 2021, '2021-04-30'),
(863, '4/4/2021', '1987 Ek Kahani Aise Bhi', 'Prof Mahendra Shirsath', 'Flipkart', '1', '1', 'DELIVERED', '2021-05-17 09:06:05', 'ProfMahendraShirsath', 4, 4, 2021, '2021-04-04'),
(864, '4/4/2021', '1987 Ek Kahani Aise Bhi', 'Prof Mahendra Shirsath', 'Flipkart', '1', '1', 'DELIVERED', '2021-05-17 09:06:05', 'ProfMahendraShirsath', 4, 4, 2021, '2021-04-04'),
(865, '4/4/2021', 'Gandhi Haar Gaye', 'Durgesh Pandey', 'Flipkart', '1', '1', 'DELIVERED', '2021-05-17 09:06:05', 'DurgeshPandey', 4, 4, 2021, '2021-04-04'),
(866, '4/12/2021', '1987 Ek Kahani Aise Bhi', 'Prof Mahendra Shirsath', 'Flipkart', '1', '1', 'DELIVERED', '2021-05-17 09:06:05', 'ProfMahendraShirsath', 12, 4, 2021, '2021-04-12'),
(867, '4/3/2021', 'Everlasting Magical Echoes', 'Dr. Kiran Prabhakar Rebello', 'Flipkart', '3', '3', 'DELIVERED', '2021-05-17 09:06:05', 'Dr.KiranPrabhakarRebello', 3, 4, 2021, '2021-4-3'),
(868, '4/7/2021', 'Pre - Historic Animals', 'Sheela\'s', 'Flipkart', '1', '1', 'DELIVERED', '2021-05-17 09:06:05', 'Sheela\'s', 7, 4, 2021, '2021-4-7'),
(869, '4/7/2021', 'Gandhi Haar Gaye', 'Durgesh Pandey', 'Flipkart', '1', '1', 'DELIVERED', '2021-05-17 09:06:05', 'DurgeshPandey', 7, 4, 2021, '2021-04-07'),
(870, '4/14/2021', 'Gandhi Haar Gaye', 'Durgesh Pandey', 'Flipkart', '-1', '1', 'RETURN_REQUESTED', '2021-05-17 09:06:05', 'DurgeshPandey', 14, 4, 2021, '2021-04-14'),
(871, '4/10/2021', 'DECODER For UPSC Mains', ' Rahul Singh', 'Flipkart', '-1', '1', 'RETURN_REQUESTED', '2021-05-17 09:06:05', 'RahulSingh', 10, 4, 2021, '2021-4-10'),
(872, '4/5/2021', 'DECODER For UPSC Mains', ' Rahul Singh', 'Flipkart', '1', '1', 'DELIVERED', '2021-05-17 09:06:05', 'RahulSingh', 5, 4, 2021, '2021-4-5'),
(873, '4/5/2021', 'DECODER For UPSC Mains', ' Rahul Singh', 'Flipkart', '1', '1', 'DELIVERED', '2021-05-17 09:06:05', 'RahulSingh', 5, 4, 2021, '2021-4-5'),
(874, '4/6/2021', 'DECODER For UPSC Mains', ' Rahul Singh', 'Flipkart', '-1', '1', 'CANCELLED', '2021-05-17 09:06:05', 'RahulSingh', 6, 4, 2021, '2021-4-6'),
(875, '4/6/2021', 'Organizational Management for Non-Government Organisations', 'Nikhil Naskar', 'Amazon', '-1', '1', 'MFNShipment', '2021-05-17 09:05:53', 'NikhilNaskar', 6, 4, 2021, '2021-04-06'),
(876, '31/05/2021', 'Natural Beauty Secrets', 'Monisha Sarage', 'KDP', '1', '1', '', '2021-06-21 05:54:31', 'MonishaSarage', 5, 31, 2021, '2021-31-05'),
(877, '31/05/2021', 'SHAPE YOUR THINKING : A Guide for Survival &amp; Success in 21st Century', 'SHASHANK  MUTNEJA', 'KDP', '1', '1', '', '2021-06-21 05:54:31', 'SHASHANKMUTNEJA', 5, 31, 2021, '2021-31-05'),
(878, '30/05/2021', 'Natural Beauty Secrets', 'Monisha Sarage', 'KDP', '1', '1', '', '2021-06-21 05:54:31', 'MonishaSarage', 5, 30, 2021, '2021-30-05'),
(879, '30/05/2021', 'Madhubani  Design Idea', 'Upasna  Mishra', 'KDP', '1', '1', '', '2021-06-21 05:54:31', 'UpasnaMishra', 5, 30, 2021, '2021-30-05'),
(880, '05/24/2021', 'Reiki - Bramhand Ki Urja Se Hone Wali Rahasyamai Chikitsa', 'AyushGupta', 'KDP', '1', '1', '', '2021-06-21 05:54:31', 'AyushGupta', 24, 5, 2021, '2021-05-24'),
(881, '23/05/2021', 'Natural Beauty Secrets', 'Monisha Sarage', 'KDP', '1', '1', '', '2021-06-21 05:54:31', 'MonishaSarage', 5, 23, 2021, '2021-23-05'),
(882, '23/05/2021', 'SHAPE YOUR THINKING : A Guide for Survival &amp; Success in 21st Century', 'SHASHANK  MUTNEJA', 'KDP', '1', '1', '', '2021-06-21 05:54:31', 'SHASHANKMUTNEJA', 5, 23, 2021, '2021-23-05'),
(883, '21/05/2021', 'Natural Beauty Secrets', 'Monisha Sarage', 'KDP', '1', '1', '', '2021-06-21 05:54:31', 'MonishaSarage', 5, 21, 2021, '2021-21-05'),
(884, '19/05/2021', 'SHAPE YOUR THINKING : A Guide for Survival &amp; Success in 21st Century', 'SHASHANK  MUTNEJA', 'KDP', '1', '1', '', '2021-06-21 05:54:31', 'SHASHANKMUTNEJA', 5, 19, 2021, '2021-19-05'),
(885, '18/05/2021', 'Natural Beauty Secrets', 'Monisha Sarage', 'KDP', '5', '5', '', '2021-06-21 05:54:31', 'MonishaSarage', 5, 18, 2021, '2021-18-05'),
(886, '17/05/2021', 'Kavit', 'Kaustubh Prabhakar  Gogate', 'KDP', '2', '2', '', '2021-06-21 05:54:31', 'KaustubhPrabhakarGogate', 5, 17, 2021, '2021-17-05'),
(887, '12/05/2021', 'Tajammul Sangeet Itihas Kosh', 'Shahnaz  Khan', 'KDP', '2', '2', '', '2021-06-21 05:54:31', 'ShahnazKhan', 5, 12, 2021, '2021-12-05'),
(888, '12/05/2021', 'Life Through My Eyes', 'Sumana .', 'KDP', '1', '1', '', '2021-06-21 05:54:31', 'Sumana.', 5, 12, 2021, '2021-12-05'),
(889, '11/05/2021', 'SHAPE YOUR THINKING : A Guide for Survival &amp; Success in 21st Century', 'SHASHANK  MUTNEJA', 'KDP', '1', '1', '', '2021-06-21 05:54:31', 'SHASHANKMUTNEJA', 5, 11, 2021, '2021-11-05'),
(890, '07/05/2021', 'Mahakaal', 'Nitin Sharma', 'KDP', '1', '1', '', '2021-06-21 05:54:31', 'NitinSharma', 5, 7, 2021, '2021-07-05'),
(891, '07/05/2021', 'SHAPE YOUR THINKING : A Guide for Survival &amp; Success in 21st Century', 'SHASHANK  MUTNEJA', 'KDP', '1', '1', '', '2021-06-21 05:54:31', 'SHASHANKMUTNEJA', 5, 7, 2021, '2021-07-05'),
(892, '06/05/2021', 'Sukhe Patte', 'Parminder Soni', 'KDP', '1', '1', '', '2021-06-21 05:54:31', 'ParminderSoni', 5, 6, 2021, '2021-06-05'),
(893, '04/05/2021', 'Scribblings From A Travellers Diary', 'Methil.S.  Vijayaraghavan', 'KDP', '1', '1', '', '2021-06-21 05:54:31', 'Methil.S.Vijayaraghavan', 5, 4, 2021, '2021-04-05'),
(894, '04/05/2021', 'Natural Beauty Secrets', 'Monisha Sarage', 'KDP', '1', '1', '', '2021-06-21 05:54:31', 'MonishaSarage', 5, 4, 2021, '2021-04-05'),
(895, '04/05/2021', 'Probability For Class (IX-XII)', 'Mr. Abhijit  Debnath', 'KDP', '1', '1', '', '2021-06-21 05:54:31', 'Mr.AbhijitDebnath', 5, 4, 2021, '2021-04-05'),
(896, '05/05/2021', 'Tunnel Construction: A Practical Approach Demystified', 'Dr. Ashok Kumar Sharma', 'GooglePlay', '1', '1', '', '2021-06-21 05:54:38', 'Dr.AshokKumarSharma', 5, 5, 2021, '2021-05-05'),
(897, '07/05/2021', 'Employability Skills', 'Shilpi Dixit', 'GooglePlay', '1', '1', '', '2021-06-21 05:54:38', 'ShilpiDixit', 5, 7, 2021, '2021-07-05'),
(898, '08/05/2021', 'Good Governance In India: Role Of Political Parties', 'Abhishek Dubey', 'GooglePlay', '1', '1', '', '2021-06-21 05:54:38', 'AbhishekDubey', 5, 8, 2021, '2021-08-05'),
(899, '10/05/2021', 'Good Governance In India: Role Of Political Parties', 'Abhishek Dubey', 'GooglePlay', '1', '1', '', '2021-06-21 05:54:38', 'AbhishekDubey', 5, 10, 2021, '2021-10-05'),
(900, '10/05/2021', 'Kuchh Kuchh', 'Anoop Upadhyay', 'GooglePlay', '1', '1', '', '2021-06-21 05:54:38', 'AnoopUpadhyay', 5, 10, 2021, '2021-10-05'),
(901, '11/05/2021', 'Madhubani Design Idea', 'Upasna Mishra', 'GooglePlay', '1', '1', '', '2021-06-21 05:54:38', 'UpasnaMishra', 5, 11, 2021, '2021-11-05'),
(902, '12/05/2021', 'Good Governance In India: Role Of Political Parties', 'Abhishek Dubey', 'GooglePlay', '1', '1', '', '2021-06-21 05:54:38', 'AbhishekDubey', 5, 12, 2021, '2021-12-05'),
(903, '13/05/2021', 'Good Governance In India: Role Of Political Parties', 'Abhishek Dubey', 'GooglePlay', '1', '1', '', '2021-06-21 05:54:38', 'AbhishekDubey', 5, 13, 2021, '2021-13-05'),
(904, '15/05/2021', 'Rishte', 'Prem Sharma', 'GooglePlay', '1', '1', '', '2021-06-21 05:54:38', 'PremSharma', 5, 15, 2021, '2021-15-05'),
(905, '15/05/2021', '1 Year A Moment In Love', 'Ashirwad', 'GooglePlay', '1', '1', '', '2021-06-21 05:54:38', 'Ashirwad', 5, 15, 2021, '2021-15-05'),
(906, '15/05/2021', '1 Year A Moment In Love', 'Ashirwad', 'GooglePlay', '1', '1', '', '2021-06-21 05:54:38', 'Ashirwad', 5, 15, 2021, '2021-15-05'),
(907, '15/05/2021', '1 Year A Moment In Love', 'Ashirwad', 'GooglePlay', '1', '1', '', '2021-06-21 05:54:38', 'Ashirwad', 5, 15, 2021, '2021-15-05'),
(908, '19/05/2021', 'Techniques in Life Science', 'Rahul Pandey', 'GooglePlay', '1', '1', '', '2021-06-21 05:54:38', 'RahulPandey', 5, 19, 2021, '2021-19-05'),
(909, '05/21/2021', 'Reiki - Bramhand Ki Urja Se Hone Wali Rahasyamai Chikitsa', 'AyushGupta', 'GooglePlay', '1', '1', '', '2021-06-21 05:54:38', 'AyushGupta', 21, 5, 2021, '2021-05-21'),
(910, '05/21/2021', 'Reiki - Bramhand Ki Urja Se Hone Wali Rahasyamai Chikitsa', 'AyushGupta', 'GooglePlay', '1', '1', '', '2021-06-21 05:54:38', 'AyushGupta', 21, 5, 2021, '2021-05-21'),
(911, '21/05/2021', 'Reminiscing Herstories', 'Sheeba Vinay', 'GooglePlay', '1', '1', '', '2021-06-21 05:54:38', 'SheebaVinay', 5, 21, 2021, '2021-21-05'),
(912, '24/05/2021', 'Rishte', 'Prem Sharma', 'GooglePlay', '1', '1', '', '2021-06-21 05:54:38', 'PremSharma', 5, 24, 2021, '2021-24-05'),
(913, '26/05/2021', 'Tunnel Construction: A Practical Approach Demystified', 'Dr. Ashok Kumar Sharma', 'GooglePlay', '1', '1', '', '2021-06-21 05:54:38', 'Dr.AshokKumarSharma', 5, 26, 2021, '2021-26-05'),
(914, '26/05/2021', 'Tunnel Construction: A Practical Approach Demystified', 'Dr. Ashok Kumar Sharma', 'GooglePlay', '1', '1', '', '2021-06-21 05:54:38', 'Dr.AshokKumarSharma', 5, 26, 2021, '2021-26-05'),
(915, '27/05/2021', 'URVIL WITH CELINA Where Sky meets the Ocean', 'John Srikanth', 'GooglePlay', '1', '1', '', '2021-06-21 05:54:38', 'JohnSrikanth', 5, 27, 2021, '2021-05-27'),
(916, '28/05/2021', 'Rishte', 'Prem Sharma', 'GooglePlay', '1', '1', '', '2021-06-21 05:54:38', 'PremSharma', 5, 28, 2021, '2021-28-05'),
(917, '26/04/2021', 'Gandhi Haar Gaye', 'Durgesh Pandey', 'Amazon', '1', '1', 'MFNShipment', '2021-06-21 05:54:48', 'DurgeshPandey', 4, 26, 2021, '2021-26-04'),
(918, '11/05/2021', 'Gandhi Haar Gaye', 'Durgesh Pandey', 'Amazon', '1', '1', 'MFNShipment', '2021-06-21 05:54:48', 'DurgeshPandey', 5, 11, 2021, '2021-11-05'),
(919, '13/05/2021', 'Gandhi Haar Gaye', 'Durgesh Pandey', 'Amazon', '1', '1', 'MFNShipment', '2021-06-21 05:54:48', 'DurgeshPandey', 5, 13, 2021, '2021-13-05'),
(920, '19/05/2021', 'The Unconventional Choices', 'Manaswini S Jois', 'Amazon', '1', '1', 'MFNShipment', '2021-06-21 05:54:48', 'ManaswiniSJois', 5, 19, 2021, '2021-19-05'),
(921, '02/05/2021', 'Scribblings From A Travellers Diary', 'Methil.S. Vijayaraghavan', 'Amazon', '1', '1', 'MFNShipment', '2021-06-21 05:54:48', 'Methil.S.Vijayaraghavan', 5, 2, 2021, '2021-02-05'),
(922, '20/05/2021', 'A Thought on Entrepreneurship   Leadership', 'Lokendra Pal Singh', 'Amazon', '1', '1', 'MFNShipment', '2021-06-21 05:54:48', 'LokendraPalSingh', 5, 20, 2021, '2021-20-05'),
(923, '20/05/2021', 'Engineering Communication', '', 'Amazon', '1', '1', 'MFNShipment', '2021-06-21 05:54:48', '', 5, 20, 2021, '2021-20-05'),
(924, '01/05/2021', 'Scribblings From A Travellers Diary', 'Methil.S. Vijayaraghavan', 'Amazon', '1', '1', 'MFNShipment', '2021-06-21 05:54:48', 'Methil.S.Vijayaraghavan', 5, 1, 2021, '2021-01-05'),
(925, '16/05/2021', 'Baagicha-E-Ghazal', 'Ronak H Bhavsar', 'Amazon', '1', '1', 'MFNShipment', '2021-06-21 05:54:48', 'RonakHBhavsar', 5, 16, 2021, '2021-16-05'),
(926, '04/05/2021', 'Scribblings From A Travellers Diary', 'Methil.S. Vijayaraghavan', 'Amazon', '1', '1', 'MFNShipment', '2021-06-21 05:54:48', 'Methil.S.Vijayaraghavan', 5, 4, 2021, '2021-04-05'),
(927, '02/05/2021', 'Scribblings From A Travellers Diary', 'Methil.S. Vijayaraghavan', 'Amazon', '-1', '1', 'Refund', '2021-06-21 05:54:48', 'Methil.S.Vijayaraghavan', 5, 2, 2021, '2021-02-05'),
(928, '02/05/2021', 'DECODER For UPSC Mains', 'Rahul Singh', 'Flipkart', '1', '1', 'DELIVERED', '2021-06-21 05:54:55', 'RahulSingh', 5, 2, 2021, '2021-02-05'),
(929, '28/05/2021', 'Vicharo Ki Son Chiraiya', 'Ratan Rashmi Raina', 'Flipkart', '1', '1', 'READY_TO_SHIP', '2021-06-21 05:54:55', 'RatanRashmiRaina', 5, 28, 2021, '2021-05-28'),
